,일자,제목,내용
13,25.07.28,신한 Econ Check-up,"관세 불확실성 완화로 경기 반등 지속- 주요국 경제지표는 부양책 효과와 관세 불확실성 완화에 힘입어 기대치 상회한 긍정적 흐름 지속. 다만 관세 영향에 노출된 제조업보다 서비스업 중심의 회복세 관찰- 미국과 유로존 7월 S&P Global PMI는 종합 기준 전월보다 개선. 다만 미국은 서비스업이 성장 (52.9→55.2) 했으나 제조업 위축세 전환(52.9→49.5)돼 부문 간 불균형 심화. 유로존은 제조업 완만한 개선(49.5→49.8) 속 서비스업 반등폭 확대(50.5→51.2)로 통화완화 누적된 효과 반영. 가격 측면에서 미국은 관세 영향에 인플레 압력 재차 확대, 유로존은 둔화되는 흐름 확인- 한국 2분기 GDP 전기대비 0.6% 성장해 증가세 회복. 내수 회복은 정책 시차로 미미했으나 관세 우려에도 수출 선방 결과. 하반기 수출 모멘텀 약화 고려 시 경기 회복 강도 여전히 미약- 유로존 7월 통화정책회의에서 기준금리 동결. 미국과 관세 협상 불확실성 고려했으나 경기 인식 개선으로 이전보다 금리 인하 필요성 주장 약화"
14,25.07.28,신한 FX Check-up,"달러화, 주요 인사 발언 및 엔화 강세 속 하락 - 달러화 97pt 초중반으로 하락. 주초 베센트 장관의 연준 의장 후임 지명 서두르지 않는다는 발언 등에도 월러 이사의 7월 인하 촉구 발언 등이 약 달러 압력 작용. 무역 정책 불확실성 역시 달러화 약세 일조. 미-일 무역 협상 타결 및 EU와의 무역 협상 타결 임박 소식에 유로화와 엔화 강세 보이며 달러 상대 약세 부각- 달러/유로 1.17달러 내외 상승. 미-EU 무역 협상 막바지 도달한 가운데 미-일 협상과 유사한 15% 관세율에 합의할 가능성이 높은 것으로 보도돼 유로 강세. 엔/달러 146엔대로 하락. 참의원 선거에서 여당 참패에도 이시바 총리 직 유지 의사 등에 확장 재정 우려 일부 완화되며 엔화 강세- 대외 강 달러 되돌림에 원/달러 1,370원 선으로 하락. 일본 선거 이후 제한된 금융시장 변동성 속에 미-일 낙관적 관세 협상에 따른 한-미 관세 협상 기대 역시 원화 강세 압력에 일조"
15,25.07.25,[Global Macro Alert] 한국 2Q GDP: 점진적 회복 국면..,"한국 2분기 GDP는 전기대비 0.6%로 반등. 민간소비와 순수출 호조가 성장 이끌어 한국 2분기 GDP가 전기대비 0.6%, 전년비 0.5%를 기록하며 당사 예상에 부합했다. 지난 분기 역성장(-0.2%, QoQ)에서 반등하면서 장기 저성장 국면을 탈피하려는 모습이다. 금번 성장은 민간 기여도가 0.5%p, 정부 기여도가 0.1%p로 민간 부문이 주도했다. 민간소비(0.2%p)와 순수출(0.3%p) 호조가 성장을 이끌었다. 국내 정치 불확실성 해소로 소비심리가 1분기 저점 이후 반등하면서 재화와 서비스 소비가 모두 늘었다. 미국의 관세 영향이 본격적으로 나타나지 않은 만큼 수출도 반도체, 석유·화학제품 위주로 증가했다. 반면 투자는 부진했다. 반도체 제조용 장비 등 기계류와 운송장비 투자가 모두 줄어들며 설비투자 기여도가 -0.1%p를 기록했다. 건설투자도 건물 및 토목건설 부진이 지속되며 감소(-0.2%p)했다."
16,25.07.25,"ECB, 가까워진 인하 마무리","ECB, 정책금리 동결 결정ECB, 재융자금리(정책금리) 2.15%로 동결. 예금금리(2.00%)와 한계 대출금리(2.40%)도 마찬가지로 동결. ECB는 2% 중기 물가 목표가 유지되고 있으며, 불확실성이 높은 환경에서도 경기가 점차 회복되고 있다고 설명"
17,25.07.25,2/4분기 한국 GDP: 하반기는 내수,"한국 2/4분기 GDP 예상치 상회 한국 2/4분기 GDP는 전기대비 0.6% 성장(전년동기대비 0.5% 성장). 민간소비(+0.5%)와 정부소비(+1.2%), 수출(+4.2%)이 개선되며 반등. 제조업(+2.7%)과 서비스업(+0.6%)도 동반 성장. 건설투자(-1.5%)는 감소 폭이 점차 축소되고 있음"
18,25.07.25,관세협상 다음은?,"미국, 일본 금리결정. 한국 포함 협상 소식 추가로 나오는지 확인 일본 참의원선거에서 우려했던 대로 여권이 과반확보에 실패했다. 이시바 총리는 사퇴는 선택지에 없으며, 미국과의 관세타결에 집중할 것임을 밝혔다. 선거 이후 일본 경제산업상은 미국에 방문하여 예상보다 신속하게 협상을 마무리했다. 대규모 대미투자, 쌀과 자동차 시장 개방을 카드로 관세율을 기존 25%에서 15%로 인하하는 데 협의했다. 다음 주 예정된 금정위에서 BOJ가 당장 금리인상을 단행할 가능성은 제한적이다. 다만 예상보다 빠르게 관세협상이 마무리된 가운데, BOJ가 향후 금리인상 시점을 결정하는 데 있어, 대외 통상관련 불확실성이 완화된 점을 고려하는지 확인할 필요가 있다. 한편, 2분기에 한국경제는 전기대비 0.6% 성장률을 기록하며, 예상치에 부합하는 수준으로 발표되었다. 트럼프가 상호관세 확정을 7월로 미룬 가운데 반도체, 석유?화학 중심으로 수출이 양호한 모습을 보이며 순수출이 +0.4%p 기여했다. 민간 및 정부소비 역시 플러스 기여도를 기록했는데, 이러한 흐름은 하반기에도 이어질 수 있을 것으로 보인다. 한국은 하반기 추가 금리인하가 예상되며, 민생회복 중심으로 재정정책 효과 역시 본격화가 예상되기 때문이다. 다만 수출의 경우 미국의 관세 확정 가능성을 배제할 수 없어, 현재 진행 중인 미국과의 협상이 잘 마무리되는지 모니터링해야 할 것이다. 8/1을 앞두고 인도네시아, 베트남에 이어 일본까지 협상타결에 속도를 내고 있다. 미 실물지표에서 아직까지는 관세 영향이 제한적으로 나타나는 가운데, 교역 상대국의 기업들이 마진축소 압력을 흡수하고 있을 가능성을 배제할 수 없다. 당분간 비미국 국가들의 협상 동향에 대해 주목할 필요가 있다. 유럽의 경우, 실물 지표 반등이 완만한 속도로 나타나는 가운데 ECB는 금리인하 마무리 국면에 진입했다. 대부분의 비미국 국가들이 과거보다는 관세율이 높아진 환경에서, 수출 외 성장동력에 대한 돌파구를 찾을 수 있을지 고민되는 시점이다."
19,25.07.25,"07/25, Kiwoom Morning Letter","Comment - 24일(목) 코스피는 장중 연고점을 찍었으나 '한미 2+2 통상협의' 연기 소식이 전해지면서 상승폭 줄어들며 3,190.45로 강보합 마감(KOSPI 0.21%, KOSDAQ -0.45%). 이에 일본 수준의 협상이 이뤄질 수 있다는 기대감 속 전날 7.51% 급등했던 자동차주는 현대차(-2.03%), 기아(-1.04%)로 약세 마감. 2분기 호실적을 공개한 SK하이닉스(0.19%)는 미관세 우려속 오름폭 축소되며 강보합 마감한 반면, 삼성전자(-0.60%)는 하락 마감. 섬유·의류(-1.93%), 전기·가스(-0.21%), 유통(-1.16%), 증권(-1.91%)도 하락 마감. 개인은 9천519억원을 순매도, 외국인과 기관은 각각 7천391억원, 1천281억원 순매수로 대응. 베센트 장관의 불참 원인과 향후 협상 일정이 미지수인 가운데 8월 1일 관세 시한이 임박한 상황이라 증시 변동성이 확대된 영향."
20,25.07.25,Market Weekly Check ME up!,"경제지표 Preview - 주 후반 고용지표에 유의할 필요. 최근 자료에서 언급했던 바와 같이 5월 민간 대기업들의 해고 예고 통보 건수가 급증한 것으로 나타난 바 있음. 해고 예고는 60일전에 이루어지는 만큼 7월 고용 지표가 부진하게 나타날 가능성이 있음. 더불어 미국 대법원에서 트럼프가 추진했던 연방 공무원 해고 방식에 대해 위헌이 아니라는 판결이 내려진 상황. 향후 고용지표의 악화가 변동성 요인으로 작용할 지 유의할 필요가 있음- 미국의 2분기 성장률이 발표될 예정. GDPnow에서는 2.4%가 전망되고 있으며, 컨센서스도 2.5% 수준으로 유사하게 형성. 1분기 급증했던 수입이 일정부분 정상화된 만큼 플러스 값이 도출될 것으로 예상되나, 단기 소비 지표들이 부진했던 만큼 예상보다 낮은 성장률이 나올 가능성도 존재. 고용과 함께 매크로 측면의 불확실성을 자극할지 여부에 주의"
21,25.07.25,07/25 Weekly Macro,"FOMC 이후, 연준의 다음 행보는? 다음 주에는 미국 FOMC 회의와 노동시장 지표 발표에 시장의 관심이 집중될 전망이다. 7 월 FOMC 에서는 기준금리가 동결될 것으로 예상되지만, 내부적으로는 의견이 엇갈릴 가능성이 있다. 최근 보우먼 연준 부의장과 월러 이사가 7 월 금리 인하를 지지하는 발언을 내놓은 만큼, 이번 회의에서는 만장일치 결정이 어려울 수 있다. 이에 따라 파월 연준의장의 기자회견에 주목하며, 향후 통화정책 방향에 대한 단서를 찾으려는 움직임이 강화될 것으로 보인다. 파월 의장은 관세 충격이 실물 경제나 물가에 어떤 영향을 미치는지 좀 더 지켜봐야 한다는 기존 입장을 유지할 가능성이 높다. 그러나 회의 내에서 금리 인하를 주장하는 목소리가 확인될 경우, 9 월 인하 가능성은 한층 높아질 수 있다. 이와 함께 FOMC 직후 주 후반에는 미국 7 월 고용 보고서가 발표될 예정이다. 비농가 신규 고용 증가 폭은 둔화되고, 실업률은 소폭 상승할 것으로 전망된다. 노동시장이 아직 견조하지만, 수요 둔화의 조짐이 점차 나타나고 있어 연준의 금리 인하 기대는 점진적으로 확대될 수 있다."
22,25.07.25,한-미 관세협상: 주식시장과 외환시장의 동상이몽,"막판에 몰린 한-미 관세협상한-미간 관세협상과 관련된 불확실성이 협상 마감시한인 8월 1일까지 국내 금융시장 변동성을 높일 것으로 보인다. 정확한 이유는 알려지지 않았지만 한미간 2+2 고위급 회담이 무산되면서 8월 1일 이전까지 협상이 타결될지에 대한 우려감이 커졌다. 특히, 베센트 장관이 오는 28~29일 스톡홀름에서 중국과 추가 관세 유예 협상 일정이 잡혀 있음을 고려하면 8월 1일까지 한-미간 최종 관세협상이 제대로 이루어질 수 있을지에 대한 의문이 있다. 미국과 일본간 관세 협상 타결도 우리 입장에서는 부담스러운 부문이다. 일본측이 전격적으로 쌀 및 특정 농산물에 대한 시장 개방을 허용하는 동시에 알래스카 액화천연가스(LNG) 개발사업 참여 등 5,500억 달러의 투자라는 카드를 제시하면서 관세 협상을 타결한 것이 우리나라 관세 협상의 기준점 역할을 할 수 있기 때문이다. 아무래도 미국측이 일본과 유사한 수준에서 협상안을 우리측에 요구할 개연성이 커진 것이다. 물론 일본과의 협상안 내용은 우리나라뿐만 아니라 EU 및 대만 등에도 유사하게 적용될 것이다. 미국과 EU와의 협상이 진척되고 있다고 하지만 최종 타결 소식이 들려오지 않는 이유 역시 일본에 비해 EU측이 트럼프 행정부를 만족시킬만한 카드를 제시하지 못하고 있을 수 있다. 이처럼 한-미간 관세협상 관련하여 다소 미묘한 분위기에 대해 외환시장과 주식시장 반등은 다소 차이를 보이고 있다. 달러-원 환율을 포함한 글로벌 외환시장은 관세 협상을 다소 낙관하는 분위기처럼 움직이고 있다. 관세 협상을 타결한 엔화 강세 속에 유로화 역시 강세 폭이 확대되었고 달러-원 환율 역시 큰 폭으로 하락, 1370원 초반수준까지 급락했다. 협상 타결을 긍정적으로 바라보고 있는 듯한 분위기다. 반면 주식시장은 다소 다른 분위기다. 미국과 협상을 타결한 일본 증시는 이틀 연속 큰 폭으로 상승했다. 유럽 및 중국 증시 역시 협상 타결 및 관세 추가 유예 기대감으로 상승세를 보이고 있다. 코스피 지수도 일본의 협상 타결 소식으로 이틀 연속 상승세를 이어가고 있지만 2+2 회답 취소 소식에 상승폭을 상당부분 반납하는 등 변동성이 확대되었다. 자칫 관세 협상 타결이 지연될 수도 있다는 우려감을 반영하고 있는 것으로 해석된다. 당사는 관세 리스크가 완화될 것으로 기대는 하고 있지만 그 동안 보고서에서 지적한 바와 같이 8월 1일까지 관세 협상이 타결하지 못하는 국가가 나타나면서 국가별 제로섬 현상이 나타날 수 있음을 지적해왔다. 제로섬 게임의 피해자가 한국 혹은 EU가 될 잠재적 위험을 배제하기 어렵다는 생각이다."
23,25.07.25,Focus on Week: 한은 금리 인하 필요성을 확인해주는 ..,"최근 한은 금리 인하에 대한 기대는 조금씩 뒤로 밀리는 기류 감지. 그러나 이런 흐름에 경계심을 가질 필요 → 최근 상황과 경제지표는 오히려 한은 금리인하 필요성을 확인해 주는 것으로 판단 트럼프발 관세 문제로 대외 환경은 여전히 혼란스럽지만 국내 경제에 대한 분위기는 온화 해지는 모습이다. 주식시장은 6월 이후 강세를 지속하고 있고 정부의 강한 경기 부양 의지 및 정책으로 인해 7월 소비자기대지수는 2021년 수준까지 큰 폭으로 상승해 있는 상황이다. 이런 가운데 이번 주 발표된 2분기 우리나라 GDP 성장률은 시장 기대치 0.5%(전기대비)보다 높은 0.6%를 기록하며 향후 경기에 대한 기대를 높이는 모습이다. 2분기 우리나라 경제 성장률 반등은 수출 호황이 지속되는 가운데 탄핵 불확실성 소멸과 선거운동 그리고 새로운 정부 출범으로 내수 기여도가 1분기 -0.5%pt에서 2분기에는 +0.3%pt로 반전된데 기인한다. 아직 소비 부양 정책이 본격화되기 전에 이미 반등을 보인 만큼 실제 민생소비쿠폰이 발행되고 사용되는 3분기는 훨씬 높은 경제 성장을 기대하고 있는 것이다. 실제 경기부양을 위한 재정지출이 본격화되는 이번 3분기는 1.0%(전기대비)에 육박하는 높은 성장률을 기록할 가능성이 높아 보인다. 그런데 국내 경기에 대한 분위기가 이렇게 개선되는 흐름에서 금융시장이 주목하는 또 다른 변수인 한국은행의 금리 인하에 대한 기대는 조금씩 뒤로 밀리는 기류도 감지되고 있다. 최근 발표된 소비자기대지수 항목 중 금리전망지수는 넉 달 만에 상승 전환되었다. 그러나 우리는 이런 흐름에 경계심을 가질 필요가 있다고 판단한다. 2분기와 3분기 경제성장률의 반등(또는 반등 기대)은 기저효과와 적극적인 정부의 재정정책에 의한 반등이지만 이 흐름이 추세화될지 여부는 아직 불확실하기 때문이다. 우선 성장률 반등의 한 축을 담당하는 수출이 3분기 이후에는 미국 관세부과가 현실화되기 시작한다는 점에서 불확실성이 있고 소비 및 내수 경기가 지속되기 위해서는 투자의 회복이 수반되어야 하는데 아직 이 부분에서는 뚜렷한 개선 조짐이 보이지 않고 있다. 이런 상황에서 경기 부양의 한 축을 담당하는 금리 인하가 미루어진다면 불확실성이 부정적인 결과로 돌아올 가능성은 더 높아진다고 보기 때문이다. 오히려 최근 경제 상황과 발표된 경제지표들이 표면적으로는 금리 인하를 서두르지 않을 수도 있겠다는 인식을 줄 수 있지만 조금 더 세밀히 뜯어 보면, 오히려 한국은행의 조속한 금리 인하 필요성을 확인해 주고 있다고 볼 수 있다.  이런 생각을 하는 이유는 우선, 올해 한국은행 금리 인하의 커다란 걸림돌 역할을 했던 가계부채나 부동산 가격 상승 부담에서 조금은 가벼워졌다는 점이다. 최근 부동산 가격의 상승세는 완연하게 한풀 꺾인 모습이다. 7월 소비자동향조사를 보면, 주택가격 전망지수가 6월 120에서 7월 109로 5개월 만에 큰 폭으로 하락했다. 아직 통계가 나오지는 않았지만, 주택 관련 대출 역시 증가세가 둔화됐을 가능성이 높다."
24,25.07.24,반쪽짜리 성장세 반등,2Q GDP QoQ 0.6% 성장. 2024년 1분기 이후 가장 높은 증가율 2분기 GDP는 전기대비 0.6% 성장하며 컨센서스(+0.5%)를 소폭 상회했다. 전년 대비로는 0.5% 성장해 아직은 0%대 성장세다. 5월 초 1차 추경 집행과 6월 신정부 출범에 따른 경기 심리 개선에도 내수 회복은 제한됐다. 관세 우려에도 총 수출이 급증하며 성장세 반등을 견인했다. 내수와 순수출 전기대비 성장기여도는 각각 +0.3%p를 기록했다. 실질 국내총소득은 수출입 물가 모두 하락했으나 수출물가의 상대적 선방에 전기대비 1.3% 늘며 GDP 성장률을 상회했다.
25,25.07.24,한국 GDP - 어쩌면 내년에는 2%를 볼 수도?,"투자 빼고는 괜찮았던 2 분기한국 2Q GDP 는 +0.6%QoQ, +0.5%YoY 로 반등해 당사 예상치를 큰 폭으로 상회했다. 전기대비 성장률은 지난해 1 분기 +1.2% 이후 최고치이다. 가장 긍정적인 부분은 소비가 드디어 반등했다는 것이다. 민간소비는 +0.5% 증가해 역시 지난해 1 분기 이후 가장 빠른 속도로 증가했다. 다만 전년비 증가율은 여전히 +0.9% 그쳐 아직 본격적인 회복까지는 아니라 볼 수 있다. 1 분기 부진했던 정부소비도 1 차 추경과 신속예산집행 등의 효과로 +1.2% 급증하면서 성장을 견인했다. 4 월 미국의 관세 부과에도 양호했던 반도체 수출과 함께 상호관세 본격 부과를 앞두고 선수요가 작용한 덕분에 수출이 +4.2% 증가했고, 순수출은 +0.3%p 의 기여도를 기록했다. 반면 투자는 건설/설비/지적재산생산물 모두에서 감소했는데, 관세 불확실성이 작용한 것으로 보인다."
26,25.07.24,잊혀진 물가 우려의 재부상 경계,"잊혀진 물가 우려의 재부상 경계 7월 동향: 미국 추가 관세 유예로 정책 불확실성 완화 이어지며 관세 충격 우려보다 미미. 상반기 비미국 중심으로 누적된 통화완화 효과가 실물경제에 반영되는 가운데 미국에서도 트럼프 대통령 주도하 감세안(OBBBA)가 7월 초 통과되고 행정부의 연준 금리 인하 압박에 부양 기대 부상 관세 우려로 낮아진 경기 눈높이를 상회한 지표 발표로 경기 서프라이즈지수 빠르게 회복. 물가는 주요국 전반적으로 서비스 수급 불균형 완화로 안정. 부양 기조 훼손을 야기하지 않으나 미국에서만 의류, 장난감 중심으로 관세 영향 반영되기 시작해 물가 경계감 점진적 확대8월 전망: 시장 관심 경기에서 물가로 이동 판단. 8월 초 미국 관세 유예 종료되나 관세 실시 여부와 관계없이 불확실성 제어 시 경기 충격 제한될 전망. 5월 이후 주요국 누적된 부양책 속 금융여건 개선도 시차 두고 경기 지표에 긍정적으로 작용. 경기 하방 위험 완화 속에 미국 중심 관세 발 물가 상승 가속화 시 통화완화 기대로 촉발된 금융여건 개선은 약화될 전망. 선제적 재고 축적분 소진 속에 유통 업체 마진 악화로 소비자들로 관세 비용 전가 가능. 상대적으로 제조 생산국인 중국과 한국 등 아시아 신흥국은 약 달러 및 낮은 물가에 확장 재정 및 추가 통화 완화 등으로 대응 가능"
27,25.07.24,반등의 시간,"한국경제 비관론 한국경제에 대한 부정적인 전망이 우세하다. 관세 불확실성은 수출에 부담이고 내수 회복도 녹록지 않다는 것이다. 지난 5월 한국은행은 올해 경제성장률 전망치를 0.8%로 큰 폭 하향조정했고, 다른 기관들도 1%대 성장이 쉽지 않을 것으로 보고 있다. 다만, 회복 시그널도 적지 않다. 구매력이 개선되고 있고, 투자는 저점을 지나고 있으며, 반도체 이외 품목 수출 반등 조짐이 나타나고 있다. 경기를 너무 부정적으로 볼 필요는 없다."
28,25.07.24,이번 구조조정의 수혜는 누가?,"정책이 중요한 중국역대 중국 증시의 상승을 견인했던 업종은 대부분 당시 중국 당국의 산업 정책의 대표 수혜 업종이었다. 2009년 경기 부양을 위해 철강, 자동차, 선박, 석유화학, 방직, 경공업, 비철금속, 장비제조, IT, 물류업 등 10 대 산업을 구조조정 및 발전 산업으로 지정하고 시장 안정을 도모했다. 당시 중국 증시에서는 자동차, 철강, 기계 등 관련 업종이 시장을 주도했다. 2009~2010 년에는 4 조 위안 인프라 정책에 힘입어 시멘트, 철강, 공정기계 등 인프라 산업체인 업종이 강세를 기록했고, 완화적인 통화정책으로 부동산 경기가 반등하면서 부동산 관련주도 증시 상승에 힘을 더했다. 2013 년~2015 년에는 ‘인터넷+’정책이 시행됨에 따라 인터넷, 클라우드 컴퓨팅, 빅데이터, IoT 등 첨단 산업이 빠르게 발전했다. 이에 따라 중국 증시에서는 기술, 미디어, 통신 업종이 증시를 주도했다. 2016~2020년에는 구조조정이 진행됨에 따라 기업 수익성이 개선되는 철강, 석탄 등 업종이 강하게 반등했고 2020년 9월부터는 탄소중립 정책으로 인해 태양광, 풍력발전, 신에너지자동차 등 관련 산업 체인에 대한 투자자의 관심이 뜨거웠다. 2025 년부터 대형주와 중소형주의 전환이 비교적 빈번하게 일어나고 있다. 1분기는 DeepSeek의 영향으로 기술주, 중소형주가 상대적으로 강했으나 2분기 경기 둔화와 당국의 자본시장 활성화 정책으로 연기금, 보험 등 장기 자금이 빠른 속도로 유입됨에 따라 대형주, 고배당주가 상대적으로 강한 모습을 나타냈다. 정책적인 측면에서 이번에는 구조조정, 신품질 생산력에 주목할 필요가 있겠다. 7/1 중국 시진핑 주석이 중앙 재경위원회 6 차 회의를 통해 내부출혈 경쟁 방지가 필요하다고 강조했고 태양광, 철강, 석탄, 자동차에 대한 구조조정이 진행될 전망이다."
29,25.07.24,"07/24, Kiwoom Morning Letter","Comment - 23일(수) 코스피는 미국과 일본의 무역협상 타결 소식이 전해지면서 3,183.77로 소폭 상승 마감(KOSPI 0.44%, KOSDAQ 0.07%). 9거래일만에 순매도로 전환했던 외국인은 3천167억원 순매수, 기관도 2천 923억원 순매수하였으나, 개인은 6천826억원 순매도로 대응. 한국도 일본과 유사한 관세율을 적용받을 수 있을 것이란 기대감이 커진 영향. 이에 현대차(7.51%), 기아(8.49%) 등 자동차주가 급등하며 상승 마감. 미국 기술주 약세 영향으로 장초반 약세를 보이던 삼성전자(0.61%)와 SK하이닉스(0.19%)도 미일 관세 협상 영향으로 상승 마감. 코스닥 시장은 미약한 상승폭 보이며 813.56으로 마감. 알테오젠(0.63%), 에코프로비엠(0.18%), HLB(0.40%)는 상승, 펩트론(-0.84%)은 하락 마감."
=======
0,22.10.19,근원 물가 23년 1분기 피크아웃 전망,1980년 인플레이션 피크아웃 과정 돌아보기: 왜 서비스 물가가 이렇게나 강한가?- 현재 러 우 사태로 촉발된 에너지 가격 급등과 마찬가지로 1970 년에는 중동 지역의 지정학적 리스크로 촉발된 오일 쇼크가 인플레이션을 야기- 당시와 현재를 비교해보면 인플레이션 해소 국면에서 현재는 70 80 년대와 달리 서비스 물가 상승세가 이어지고 있음- 이는 미국 개인소비가 상품 소비에서 서비스 소비 중심으로 소비 패턴이 변화했기 때문 팬데믹으로 서비스 수요가 인위적으로 억눌리면서 상품으로 쏠렸던 수요가 리오프닝 이후 정상화되는 과정 속에서 서비스 수요가 강하게 뒷받침되고 있음- 고용시장도 서비스업 중심으로 이루어져 있다는 점도 서비스 수요 견조 임금 상승 서비스 물가 상승 의 프로세스를 견고하게 만드는 요인
1,22.10.18,"마지막이 될 영국 예산안 수정, 신뢰 회복을 향하여","없었던 일로 하고 싶었던 예산안, 정치적 기반은 계속 흔들리고 있다제레미 헌트(Jeremy Hunt) 영국 재무부 장관은 취임 4일째인 17일 성명문을 통해 ""The Growth Plan 2022"" 감세안 정책의 추가 철회안을 발표했다. 재무부는 오는 31일에 경제 전망과 함께 중장기 재정계획을 발표할 예정이었으나 예산안 변경에 따른 시장 민감도를 반영해 예정보다 2주 앞당겨 변경사항을 일부 먼저 발표했다. 헌트 장관은 정부가 시장을 통제할 수는 없지만, 공공 재정의 지속가능성에 대한 확신은 제공할 수 있다며 시장 안정이 현재 정부의 가장 중요한 목표임을 강조하는(the most important objective for our country right now is stability) 모습을 보였다."
