,일자,제목,내용
<<<<<<< HEAD
0,25.07.29,"경제학월(月)론 트럼프 정부, 불안이 기대로","글로벌 매크로 이슈 미국 AI 투자, 살아있네- 7월 미국 실적시즌 시작을 앞두고, 시장 관심은 다시 경제 지표로 향하고 있음. 2분기 초부터 시장 예상보다 높은 관세 발표에 경기 침체 우려가 확산, 지난 분기 실적 가이던스 제공을 포기한 기업이 많았던 만큼 시장 관심이 집중. 관세 불확실성 뿐만 아니라 지정학적 리스크, 불법이민자 추방 강화 등으로 기업 생산 및 투자가 지연되고, 고용시장에서는 관망이 장기화- 하지만 AI 등 첨단 산업에 대한 투자 수요는 여전히 견조한 것으로 판단. 지난 1월 딥시크 충격 이후 AI 생산성 개선 효과에 대한 의구심 및 관련 투자 과열 우려가 있었으나, 오히려 중국에 대한 견제 및 첨단 산업 패권 유지를 위해 적극적인 투자가 시행. 게다가 빅테크에 집중됐던 AI 인프라 투자 수요는 정부 주도 소버린 AI 투자로 확장. 전세계적으로 재정정책 의존도는 높아지고, 지정학적 리스크가 지속되고 있는 상황에서, AI 생태계 활성화, 인력 개발 등 역량을 구축하기 위한 소버린 AI 투자는 지속될 전망- 미·중 양국을 중심으로 첨단 산업 공급망 양분화가 본격화 되고 있는 가운데, 미 정부는 반도체 관세 면제, AI 확산 프레임워크(Framework for AI Diffusion) 철회 등 규제 완화로 투자 유치, 주도권 확보에 적극적으로 나설 전망. 한편, 중국 견제를 위한 규제는 여전- 5월 미국 핵심자본재수주(항공기 제외 비국방)는 1.7% 증가 전환, 출하 역시 전월보다 개선된 0.5% 증가. 4월 부진 이후 기저 효과 영향도 있었지만, 컴퓨터 및 전자기기를 중심으로 견조한 증가 흐름이 지속. AI 인프라 투자를 위한 전력기기 및 부품 주문 역시 증가 추세 유지- 한편, 1분기 빅테크 실적 발표에서 확인했듯이, AI 수익화에도 진전을 나타내고 있는 모습. 시장은 올해 ROI 플러스 전환을 기대. 미국 인구조사국 기업 대상 조사에 따르면, AI 도입 비율이 빠르게 상승하고 있어 관련 매출 증가에 기여- AI 도입이 빨라지면서 미국 경제는 생산성 개선 기대. 기술의 노동력 대체 등으로 기업 비용은 절감, 인플레이션 압력 완화 효과. 물가 안정 및 고용 수요 둔화로 통화완화 여건 조성에도 기여할 전망"
1,25.07.29,주간 애널리스트 심리 분석,"애널리스트 보고서의 심리 팩터MSCI Analyst Sentiment Index 의 핵심은 주당순이익(EPS), 목표주가(Price TGT) 등 5 개 그룹으로 구성된 지수의 산출 방식, Barra 팩터 모델을 활용한 정교한 최적화 프로세스를 기반으로 하고 있다. 그러나 현실적으로 국내 시장에 적용하기 위해서는 국내 시장의 구조적인 특성을 반영한 방법론의 수정이 필수적이다. 구체적으로 IT 섹터에 대한 높은 비중, 매수 일변도의 국내 애널리스트 투자의견 등 최적화 모델의 세심한 보정이 필요하다. 특히나, 2020 년부터 5 년간 발간된 애널리스트의 기업 투자의견을 살펴보면 매수(적극매수 포함) 비중이 93.1%로 2000년대 67.3%, 2010년대 89.6%에 비해 쏠림현상이 더욱 심화되어 왔다(도표 2,3 참조). 애널리스트 보고서의 핵심은 데이터(숫자) 뿐만 아니라 그 숫자를 뒷받침하는 논리와 확신의 강도에 있다. FinBERT 모델의 활용은 보고서 전체의 텍스트를 분석하여 이러한 정성적인 뉘앙스를 포착할 수 있다. 예를 들어, 목표주가는 유지하더라도 “경쟁 심화로 인한 수익성 악화 우려” 와 같은 부정적 분석이 포함된다면 부정적 신호(signal)로 감지할 수 있다. 이는 정량적인 분석의 한계를 보완하는 핵심적인 장점이다."
2,25.07.29,"07/29, Kiwoom Morning Letter","Comment - 28일(월) 코스피는 한미 무역 협상을 주시하면서도 삼성전자 급등에 힘입어 3,200대를 회복해 3,209.52로 상승 마감(KOSPI +0.42%, KOSDAQ -0.32%). 테슬라와 대규모 반도체 위탁생산 공급 계약을 체결한 삼성전자(6.83%)는 상승 마감하며 7만 전자 회복. 한미 무역 협상 관련 미국 측이 협력에 관심을 보인 조선주인 HD현대중공업(4.50%), 한화오션(8.44%) 등도 상승 마감. 반면, 군산조선소 관련 한미 협상 이슈로 중국 반발 우려가 부각되며 중국 소비주인 하이브(-1.95%) 등 엔터주와 아모레퍼시픽(-2.24%) 등 화장품주 하락 마감. 이재명 대통령의 '이자 장사' 발언과 금융당국의 대응 속 KB금융(-6.99%), 신한지주(-5.62%) 등 금융주도 하락 마감."
3,25.07.29,"관세, 제2의 플라자 합의 그리고 여파는?","내용과 영향은 다르지만 트럼프 관세정책은 결국 제2의 플라자 합의 성격 관세 전쟁이 사실상 미국의 일방적 승리로 끝나는 분위기인 가운데 내용과 영향은 다르겠지만 트럼프 관세 정책이 제2의 플라자 합의와 같은 느낌이다. 플라자 합의는 미국 경제가 심각한 쌍둥이 적자(재정 및 경상수지 적자)에 직면하고 일본과 독일(당시 서독)에 제조업 패권이 넘어갈 위기에 직면하자 독일 및 일본 등 주요 선진국으로 하여금 반강제적으로 대폭적인 달러 약세를 용인케 한 합의이다. 보호무역주의 강화라는 수단을 통해 미국으로부터 막대한 무역수지 흑자를 얻고 있던 국가들에 대해 희생을 강요한 것이다. 이런 관점에서 미국과 주요국간 합의된 관세 협상 내용을 보면 달러가 아닌 관세라는 수단의 차이만 있을 뿐 미국으로부터 대규모 무역수지 흑자를 얻고 있는 국가들에게 일방적인 희생을 요구했다는 점에서 제2의 플라자 합의로 볼 수 있다는 판단이다. 즉, 자국 통화의 대폭적인 약세가 아닌 관세는 물론 대미 투자 확대, 미국산 물품 구매 확대 등을 통해 미국의 보호주의 화살을 일부 피하게 된 것이다. 관심은 이번 관세 합의가 초래할 영향이다. 단기적으로 미국은 상당한 실익을 챙길 수 밖에 없다. 앞서 언급한 바와 같이 관세 전쟁은 미국의 일방적인 승리로 관세 협상이 마무리되었기 때문이다. 중장기적으로 볼 때도 미국이 여타 주요국에 비해서는 유리한 위치에 점할 수 있는 계기가 될 것으로 보인다. 일단 85년 플라자 합의 이후 미국 경기 및 금융시장 상황을 보면 플라자 합의가 미국 경제에 전반적으로 긍정적 영향을 미쳤다. 미국 재정 및 무역수지가 개선되었고 성장률도 견조한 추세를 유지했기 때문이다. 물가가 80년대 후반 다소 상승했지만 이는 90년 걸프전을 앞두고 유가 불안 등이 나타났기 때문으로 여겨진다. 특히 걸프전으로 90~91년 미국 경제가 침체를 맞이하기도 했지만 이후 미국 경제는 재정수지가 흑자로 돌아서고 IT 투자 붐과 함께 90년대 장기 호황을 맞이하는 등 미국 예외주의 현상이 피크를 찍게 된다. 반면, 85년 플라자 합의 직후 독일 및 일본 등 주요국 경제 역시 2~3년간 양호한 흐름을 이어갔지만 90년을 기점으로 일본은 자산버블 붕괴로, 독일 경제는 동서독 통합과 구소련체제 붕괴 등으로 결국 힘겨운 국면에 진입하게 되었고 미국과의 제조업 주도권 싸움에서 완전히 밀려나게 된다. 결과적으로 꼭 플라자 합의만은 아니지만 플라자 합의는 미국 경제의 호황 기반을 만들었고 경제패권을 확실히 찾아오는 출발점이 되었다고 평가할 수 있다."
4,25.07.28,줄어드는 공급과 하향 조정될 고용 데이터,낮아지는 고용에 대한 눈높이고용시장 공급이 빠르게 줄어들고 있다. 경제활동참가율은 이번 사이클에서 사실상 최저 수준이다. 역사적으로 이민자의 영향이 적을 경우 경제활동인구 감소는 경기 둔화를 의미했다. 하지만 금번 사이클의 경우 이민자 감소가 일정부분 영향을 주고 있는 것으로 보인다. 합법적 이민자의 유입도 크게 줄어들고 있다. 샌프란 연은에서는 CBO 전망치보다 낮은 이민자 유입을 예상하고 있다. CBO는 올해 유입될 이민자 수로 200만 명을 예상했지만 올해 상반기 유입 속도를 가정하면 약 85만 명 수준이 될 것이다. 공급 감소는 고용시장의 균형점을 바꾸는 요인이다. 더 적은 일자리 증가에도 우려를 키울 필요가 없어진다. 실업률이 상승하지 않는 최소한의 일자리 성장세도 줄어든다. 작년보다 일자리 증가 폭은 줄어들었지만 실업률은 크게 상승하지 않았다. 실업률은 작년 7월보다 낮은 수준이다. 그렇다고 고용시장의 저성장과 실업률이 상승하지 않는 현상이 마냥 좋은 것은 아니다. 수요 둔화 이상으로 공급이 감소하는 것은 인플레를 자극할 수 있고 잠재성장률 하향으로 이어진다. 코로나 당시 수요가 공급보다 강할 때 임금이 인플레로 이어지는 경우를 확인할 수 있었다. 현재 고용의 공급 둔화는 연준이 금리 인하에 있어 보수적으로 움직일 필요가 있음을 시사한다.
5,25.07.28,별걸 다 보여주는 매크로: 새로운 움직임들의 관찰,"한국 2분기 GDP : 반등에 성공 2분기 한국의 성장률은 QoQ 0.6%(YoY 0.5%)를 기록하며 당사의 예상치에 부합했다. 한국 경제의 1분기 저점에서 확실히 바닥을 지나고 있다고 볼 수 있다. 지출항목별로 살펴보면 민간소비는 1분기 QoQ -0.1% 역성장에서 2분기 0.5% 성장으로 반등에 성공했고, 1분기 정체되었던 정부 지출은 QoQ +1.2% 성장을 기록했다. 1분기 QoQ -0.6% 역성장을 기록하며 부진했던 수출은 반도체, 화학 및 석유 제품 출하량 증가에 힘입어 QoQ +4.2%의 급격한 성장을 기록하며 반등했다. 한편 시설 및 건설 투자 감소로 인해 투자는 QoQ 1.5% 감소했다. 이는 5년 연속 QoQ 역성장을 기록했다. 한국 경제의 회복 모멘텀은 지속될 것으로 예상한다. 3분기 부터 추경의 효과가 반영될 것이다. 물론 한국의 현재 화폐유통 속도, 재정승수 등을 고려할 때, 1~2차 추경의 효과는 기대 보다 크지 않을 수 있다. 다만 소비자 심리 지표가 4년 만에 최고치를 기록하는 상황으로 눌려 있던 소비의 반등에 힘입어 추경의 효과가 반영될 것으로 기대한다. 미국과의 무역 협상은 여전히 불확실성이 남아 있으나, 미국의 주요 교역국들에 비해 관세율의 차별화는 크지 않을 것이다. 한국도 일본이 미국과 체결한 15%의 관세율을 체결할 수 있다면, 수출 업체들의 마진 감소 폭이 줄어들 것이고 글로벌 제조업의 완만한 수요 회복 기조와 함께 수출 사이클의회복을기대해볼수있을것이다. 한편 건설투자의 부진은 하반기에도 고민 거리다. 금리 인하에도 PF부진, 지방을 중심으로 한 미판매 부동상 재고 등 아직 해소해야 할 과제가 많은 상황으로 하반기에도 성장률의 하방 요인으로 작용할 것이다. 반면 설비투자는 조금은 개선될 여지가 있다고 예상한다. 대내외 수요가 점진적으로 개선되는 흐름인데, 관세 협상을 통한 마진 감소 폭 축소와 환율 안정에 따라 약하게나마 개선될 것으로 기대한다. 투자 부분에 대한 회복 기대가 낮은 상황이지만 대내외 여건의 개선으로당사는 올해 1.0%, 내년 1.9% 성장률 전망을 유지한다."
6,25.07.28,관세 중간 점검 ,"일본 관세 타결 이후 빨라지는 주요국 관세 협상 트럼프 대통령의 예고와 달리 미국과 일본의 관세 협상이 빠르게 타결됐다. 미국내 투자 확대, 쌀, 자동차 수입 개방 등 여러 조건이 붙었으나, 관세율은 자동차 포함 15% 수준으로 시장은 안도했다. 세부내용에 대한 확인이 필요하지만, 일본 역시 여타 국가 대비 상대적으로 낮아진 자동차 관세에 긍정적인 분위기다. 하지만 트럼프 대통령 서한에서 언급된 8월 1일이 다가오고 있으며, 관세 하한이 점점 높아질 수 있다는 우려에 주요국은 관세 협상을 서두르는 모습이다. 현재 미국의 평균관세율은 10%대 초반이나, 관세 협상이 마무리면 이보다 높은 15%대로 올라설 것으로 시장은 예상하고 있다. 관세율이 확정된다면, 결국 미국 기업의 상품 판매가격 인상이 가능해진다. 아직 관세가 확정되지 않은 상황에서 급여 증가세가 둔화되고 있고, 교역상대국에서 관세 비용 일부를 부담하고 있어, 물가는 시장 예상 수준을 하회하며, 제한된 상승 흐름을 나타내왔다. 하지만 경기 우려 약화 및 자산가격(주식) 회복, 예상보다 빠르게 통과된 감세안 등은 서비스업 중심으로 경기 과열 가능성을 높여주고 있다. 향후 발표될  고용지표에서 서비스업 임금 상승세가 다시 확대될 경우, 추세적 물가상승 재개에 대해 경계할 필요가 있다."
7,25.07.28,7월 FOMC 소수의견과 QRA의 부담,"7월 FOMC, 인하 의견이 몇 명일까? 이번 주 예정된 FOMC에서 연준은 기준금리를 현 수준(4.25~4.50%)에서 동결할 전망이다. 금리선물에 반영된 연내 인하폭은 50bp 에 조금 못 미치는 수준에서 움직이고 있다. 7월 회의를 제외한 9,10,12월 중 2번의 인하가 시행될 가능성을 이미 금리에 온전히 반영한 상태다. 1) 관세 협상이 종료되기 직전으로 2) 물가에 기존 관세 영향이 반영되기 시작했으며 3) 고용 둔화가 본격적이지는 않은 시점이므로 7 월 회의에서 인하 시그널을 강하게 주기는 어렵다. 기자회견에서는 동결 결정의 배경이 위와 같음을 설명하고 인플레이션에 대한 우려는 드러내되, 인하가 필요하다면 시행하겠다는 어조 정도를 기대해볼 수 있겠다. 시장에 좀 더 영향을 미칠 만한 요소는 위원들의 생각이다. 점도표는 없지만 이번 금리결정이 만장일치가 아닐 가능성이 높다. 때문에 인하 의견을 제시한 위원의 수에 따라 9월 인하 기대가 좀 더 강화될 수는 있겠다. 현재로서는 최근 인하 의견을 분명히 한 크리스토퍼 월러 이사가 인하 소수의견을 제시할 것으로 보인다. 추가적으로 인하에 우호적인 위원은 미셸 보우만 부의장(금융감독)으로  6월 FOMC 이후 인하 필요성을 언급했던 적이 있다. 다만 현재 금리에 이미 9 월 인하 가능성이 64.5%나 반영되어 있기 때문에 금리에 미치는 영향력은 제한될 것으로 보인다. 9월 FOMC 전까지 미국 10년 금리가 4.4%를 중심으로 방향성 없이 등락을 보일 것이라는 전망을 유지한다."
8,25.07.28,순환매는 대안이 아니다,"트럼프 관세의 역설트럼프 대통령의 관세 불확실성이 끝을 향하고 있다. 지난주 일본에 이어, EU 에 대한 관세 협상 타결 가능성이 높아졌다. 글로벌 증시는 긍정적으로 반영했다. 그러나, 15%대에 달하는 관세에 마냥 안도해야 하는 것인지는 의문이다. 연초 트럼프 대통령 정책 우려가 컸다. 하지만 트럼프 취임 이후 전세계 교역량은 오히려 증가했다(도표 1). 관세 이전 물량을 확보하려는 선수요 덕분이다. 미국과 교역하는 지역들의 수출 증가율은 지난해 하반기보다 높다. 대만 수출은 지난해 하반기 8.6%yoy 에서 올해 상반기 27% 증가했다(도표 2). 베트남 등 동남아 지역과 아일랜드 등 유럽 수출 증가율도 높아졌다. 안타깝게도(?) 한국 수출만 감소했다(-0.3%yoy)."
9,25.07.28,"7월 FOMC 프리뷰: 연준의 분열, 9월 인하 가능성을 밝..","7 월 FOMC, 기준금리 동결 전망: 물가에 대한 걱정 7 월 미국 기준금리 4.25~4.50% 동결을 전망한다. 물가에 대한 우려가 커질 것으로 보이기 때문이다. 미국 6 월 CPI 발표 결과 초근원 CPI 상승 폭이 확대되었다. 거기에 상품 가격 기여도가 확대되면서 관세의 물가에 대한 영향도 좀 더 선명하게 나타났다. 연준 입장에서는 물가에 대한 우려가 커질 수 있는 결과다. 6 월 고용보고서에서도 비농업 고용은 예상 상회, 실업률은 감소했다. 연준이 빠르게 금리 인하를 단행해야 할 만큼 고용시장의 급격한 무너짐은 보이지 않는다."
10,25.07.28,"07/28, Kiwoom Morning Letter","Comment - 25일 (금) 코스피는 한미 무역협상 추진 경과를 주시하며 박스권 움직임을 보이다가 3,196.05로 강보합 마감(KOSPI 0.18%, KOSDAQ -0.36%). 관세 불확실성 지속으로 현대차(-0.46%), 기아(-0.86%)등 자동차주는 하락 마감. SK하이닉스(-1.30%), 삼성전자(-0.15%) 등 반도체 대형주들도 약세 지속. 업종별로 보면 기계·장비(1.03%), 운송장비·부품(0.97%), 전기·가스(1.26%), 증권(1.02%)은 상승, 섬유·의류(-2.21%), 제약(-1.59%), 전기·전자(-0.50%), 유통(-0.40%)은 하락 마감. 외국인과 기관은 각각 2천705억원, 1천99억원 순매수했고, 개인은 4천625억원 순매도로 대응. 산업부 장관과 미상무장관의 회동에서 관세 완화 및 제조업 협력 논의가 이루어지며 시장 긴장 완화된 영향. 한편, 코스닥은 기관의 매도세 속에 806.95로 하락 마감."
11,25.07.28,"관세와 통화정책, 막바지 국면","주간 동향: 관세 협상에 좌지우지된 글로벌 외환시장 - 달러화가 3주만에 소폭 하락함. 일본에 이어 EU와의 관세 협상 타결 기대감, 트럼프 대통령의 약달러 옹호 발언 및 7월 FOMC회의 앞둔 관망 분위기 등이 달러화 약세 압력으로 작용함- 유로화는 다시 1.17달러대를 회복함. 미국과의 관세 협상 타결 기대감, 14개월만에 최고치를 기록한 독일 IFO지수 및 ECB의 금리 동결 결정 등 모처럼 다양한 유로화 강세 재료가 부각됨- 엔화도 소폭 강세를 보임. 참의원 선거에서 연립 여당의 과반수 확보 실패에도 불구하고 전격적으로 미국과 관세 협상에 타결한 것이 엔 강세로 이어짐. 다만, 강세폭은 여전히 제한적 수준에 그침- 역외 위안화도 강세를 보임. 미국과의 관세 유예를 재연장하기 위한 협상 개최 소식과 달러화 강세 여파로 위안화도 강세를 보임- 호주달러 역시 글로벌 외환시장 흐름에 동조화되면서 강세를 보임- 달러-원 환율은 전주대비 소폭 하락에 그침. 달러 강세와 예상치를 상회한 2분기 국내 GDP 성장률 등의 영향으로 하락폭이 확대되던 달러-원 환율은 미국과의 관세 협상 불확실성이 재차 불거지면서 하락폭을 대부분 반납함"
12,25.07.28,8월초 관세 쇼크 해제 분위기,"미국과 EU간 관세 협상 타결로 8월초 관세 쇼크 먹구름은 거치기 시작 글로벌 금융시장에 드리워졌던 거대한 관세 먹구름이 거치고 있다. 트럼프 대통령 취임 이후 지속되었던 관세 먹구름이 어느정도 사라질 공산이 커졌기 때문이다. 글로벌 금융시장에서 가장 중요했던 미국과 EU간 관세 협상이 마침내 타결되었다. 미국과 EU간 주요 관세 협상 타결 내용은 다음과 같다.1) EU산 제품에 대한 15% 관세 부과: EU산 자동차에 대해서도 15% 관세2) EU측, 미 에너지 7,500억 달러 구매(연간 2,500억 달러씩, 향후 3년간 총 7,500억 달러 구매) 및 미국에 6,000억 달러 투자3) 다만, 반도체 및 의약품에 대해서는 양측의 발표 내용이 다소 차이가 있어 추가 논의가 진행될 전망임EU와의 관세 협상 타결 내용은 일본과의 합의 내용과 유사한 수준이다. 합의 타결이 쉽지 않을 것으로 예상되던 미국과 EU간 합의가 이루어진 배경에는 양측 모두 관세 불확실성 장기화에 따른 경제적 부담감이 크게 작용한 것으로 판단된다. 특히, 미국 입장에서 관세발 인플레이션 압력이 예상보다 크지 않다고 하지만 합의 실패로 EU산 제품 등에 대해 고율의 관세를 부과한다면 관세발 인플레이션 압력이 현실화될 여지는 충분했다. 더욱이 트럼프 대통령의 미 연준의 금리인하 요구 역시 관세 리스크가 완화되어야 현실화될 수 있다는 점도 일부 작용한 것으로 여겨진다. 무엇보다 관세 정책으로 미국이 이미 상당한 실익을 얻고 있어 관세 불확실성을 확산시킬 필요성이 낮아졌다는 점이 이번 합의에 이른 증요 요인으로 평가된다. 미국 경제는 관세 수입 급증으로 재정수지 개선세 가시화, 관세를 통한 중국 압박 그리고 리쇼오링 강화 분위기 등 예상을 상회하는 성과를 얻고 있다. 특히, 일본에 이어 EU에서도 대규모 미국산 제품 및 에너지를 구매하기로 약속했고 일본과 EU가 각각 5,500억 달러와 6,000억 달러 규모의 대미 투자에 합의한 것은 예상치 못한 관세 협상 결과물이다. 그리고 관세 정책 피로감으로 인한 트럼프 대통령 지지율 하락도 관세 리스크가 완화 일조했다. CBS와 여론조사 업체 유거브(YouGov)의 최근 여론조사(7월16∼18일) 결과에 따르면 트럼프 대통령의 지지율은 42%로 나타났다. 3월 2일 51%, 3월 30일 50%, 4월 13일 47%, 4월 27일 45%, 7월 현재 42%로 지지율은 계속 하락 중이며 정책별 지지율에서 관세전쟁으로 인한 물가와 인플레이션에 대한 반대는 64%에 달하고 있다. 관세정책이 지속될 경우 트럼프 대통령 지지율에 경고 등이 켜질 수 있음을 시사한다. 이제 관세 공은 국내로 넘어왔다. 이번주 국내 금융시장 흐름에 있어 가장 중요한 변수는 미국과의 관세 협상 타결이다. 낙관도 비관도 할 수 없는 상황이지만 일단 베선트 재무장관과의 회담이 개최될 것으로 알려지고 있어 조심스럽게 타결을 기대해 본다. 일본과 EU와의 관세 협상 타결 내용이 기준점이 되고 있어 우리나라가 이에 상승하는 협상안을 제시할 수 있을지가 관건이다. 더욱이, 러트닉 미국 상무장관은 무역확장법 232조에 근거한 반도체 관세를 ""2주 후에 발표할 것으로 예상한다""고 밝히고 있어 우리나라와 미국간 관세 협상에서 반도체 관세율도 중요한 쟁점 중에 하나가 될 것이다. 관세 협상이외에도 이번주에는 FOMC회의와 일본은행 금정위가 개최될 예정이다. 미 연준이나 일본은행 모두 금리동결이 확실시되는 가운데 관심거리는 미 연준의 경우 금리인하 시그널, 일본은행은 금리인상 시그널을 던져 줄지다. 우선 미 연준의 경우 금리인하 시그널이 가시화될 여지가 커지고 있다. 우선 이번 FOMC회의에서 최소 2명 이상의 금리동결 반대표가 나오면서 9월 금리인하 기대감을 높일 것으로 보인다. FOMC회의에서 2명의 반대표가 나온다면 그린스펀 의장 재직시였던 1993년 12월 이후 근 30년만에 미 연준내에서 통화정책 결정과 관련된 큰 이견이 표출되는 것이다. 따라서 이번 회의에서 2명 이상의 반대표가 나올 경우 9월 금리인하는 더욱 탄력을 받을 여지가 크다. 여기에 일본과 EU와의 관세 협상마저 타결되면서 파월의장과 미 연준의 금리 동결 명분으로 내세웠던 관세 불확실성 리스크가 해소되었다는 점도 파월의장 입장 변화로 이어질 가능성이 커졌다. 한편 일본은행의 경우에는 추가 금리인상과 관련하여 원론적 언급에 그칠 것으로 예상된다. 미국과의 관세 협상 타결로 관세 불확실성이 완화되었지만 참의원 선거이후 정치 불확실성, 초장기물 국채 금리 불안 현상 등을 고려할 때 일본은행이 추가 금리인상과 관련한 매파적 신호를 금융시장에 던져 주기에는 부담스럽다. 따라서 일본은행발 엔 캐리 트레이드 청산 위험이 재차 불거지지는 않을 것으로 예상된다. 이 밖에도 6월 PCE와 7월 고용지표 등 굵직한 경제지표가 발표될 예정이지만 주요국과의 관세 협상 타결로 지표의 영향력은 약화될 것이다."
