,일자,제목,내용
24,22.10.11,연준 눈치보기 속 달러화 보합세,"- 명목달러지수는 전주대비 보합. 주중 미국 8월 구인건수가 급감한 가운데 9월 ISM 제조업지수 고용 항목 역시 큰 폭으로 후퇴. 연준의 긴축 속도 조절 기대 부상해 약 달러 자극. 크레딧스위스의 재무 건전성 우려가 이어지며 CDS 프리미엄 오름세 이어간 점도 연준의 피봇(Pivot) 기대 뒷받침. 그러나 주 후반으로 가면서 9월 고용지표발표를 앞둔 경계감에 강 달러 반전. 영국 정부와 유럽은행의 건전성에 대한 우려 또한 안전자산인 달러화 수요 유입 요인- 유럽 통화 반등 연장(달러/유로 전주대비 +0.8%, 달러/파운드 +1.5%). 영국 정부가 정치적 부담에 못 이겨 감세안을 부분적으로 철회한 영향. 엔/달러는 전주대비 0.2% 상승. 미국 고용지표 발표를 앞두고 미국 시장금리 상승세 재개되며 미-일 금리 차 확대됐기 때문. 신흥국 통화 가치는 전주대비 0.1% 하락. 5%대 하락한 러시아 루블화 제외하고 대체로 강세. 원/달러는 전주대비 2.6% 하락. 연준 긴축 속도 조절 기대와 함께 주식시장에 외국인 자금 유입된 영향"
25,22.10.11,경기 둔화 및 물가 안정 징후에도 매파적 연준 입장 ..,"- 상대적으로 견고했던 미국 제조업 경기 모멘텀 약화. 미국 9월 ISM 제조업지수는 50.9 기록해 전월(52.8) 및 컨켄서스(52.3) 모두 하회. 세부항목 중 신규주문(47.1)과 고용(48.7)이 기준치(50) 하회하는 등 제조업 수요 약화 시사- 미국 8월 구인건수는 1,005만건으로 2020년 4월 이후 최대폭 감소. 8월 경제활동참가율 개선과 함께 고려 시, 긴축에 따른 노동 수요 축소보다 공급 회복에 타이트한 노동 수급 환경 개선 추정. 인건비를 약 5개월 선행하는 구인율 하락으로 물가 안정에 대한 기대 고조. 9월 5주차 신규실업수당 청구건수는 21.9만건으로 전주대비 2.9만건 늘며 고용시장에서도 긴축 충격 일부 확인- 경기 둔화 및 물가 안정 징후에도 연준은 긴축 기조 유지. 연준위원 대부분이 최근 일부 지표 개선에도 인플레이션 안정 위한 긴축 정책 필요성 역설. 바킨리치몬드 연은 총재는 강 달러에 따른 글로벌 경제 위험 증가에도 연준은 미국 경제에 초점 맞출 것이라고 언급. 대외 불안에 따른 연준 피벗 가능성 차단- OPEC+는 정례회의에서 11월부터 200만배럴/일 감산 결정. 목표 생산량 대비 하회한 생산 고려 시 실제 감산 규모는 100만배럴/일로 추정. OPEC+ 감산은 유가 급등 요인이기보다 경기 침체 우려에 따른 유가 하방 압력 제어하는 요소"
26,22.10.11,OPEC+의 대규모 감산 조치에 유가 상승,- WTI 가격은 전주대비 11.3% 상승. OPEC+가 11월부터 당초 예상을 상회한 하루 200만배럴 감산 합의. 내년 세계성장률 전망치 하향 조정에 따라 수요 둔화가 우려되는 가운데 선제적으로 감산에 돌입한 것으로 판단. 지난주 미국의 원유와 휘발유 재고가 예상보다 큰 폭으로 감소한 점도 유가 상승 요인- 금 가격은 전주대비 3.0% 상승. 국채금리 내림세와 달러화 약세 흐름에 연동되며 금 가격 상승. 금융시장 불안에 따른 안전자산 선호심리가 강화되고 저가 매수세가 유입되며 금 가격 상방 압력- 주요 산업금속 가격 상승. 미국 9월 ISM 제조업지수가 부진한 데 더해 8월 구인건수가 감소하는 등 경기 둔화 및 물가 안정 신호에 연준의 공격적 금리 인상 기조 후퇴 기대가 반영된 영향. 중국 정부의 인프라 건설 지출 투자 확대 노력도 산업금속 가격 지지- 곡물별로 혼조세 시현. 옥수수와 밀 가격은 상승했으나 대두 가격은 하락. 이번주 주식시장이 강세를 보이며 투자심리 회복되며 곡물 가격도 대체로 강세. 다만 대두 가격은 미국 중서부 지역의 수확 진전 소식에 하락
27,22.10.07,9월 미 근원 CPI > 헤드라인 CPI 양상 지속,"9월 미 헤드라인 CPI 는 +0.2% M oM, + 8.1% YoY, 에너지 푸드 제외 CPI 는 +0.4% MoM , +6.5% Y oY 예상 7 월 CPI 의 양상과 같이 전체 물가상승은 둔화되나 핵심 물가 상승은 빨라지는 양상 에너지 , 연료 부분 인플레이션은 원유 등 에너지원의 수입가격 하락 영향을 받고 있으나 , 재화 서비스 월세 등은 각기 요인에 따라 비용상승 및 최종재 가격인상이 빨라지고 있음 2 022 년 상반기에는 에너지 연료 푸드 부분이 인플레이션의 빠른 가속을 주도했다면 하반기부터는 재화 및 서비스 소비 등 근원 인플레이션 가속으로 전이 연말 소비수 요를 감안 시 이러한 인플레 경향이 유지될 수 있음"
28,22.10.07,OPEC의 정치적 감산,"OPEC+는 11월부터 일일 200만 배럴 감산에 합의OPEC+가 10월 정례회의를 통해 감산에 합의했다. 지난 달에 이어 두 번째 감산 결정으로, 11월 원유 생산량을 일일 200만 배럴 줄이기로 했다(8월 생산량 대비). 세계 경제의 침체 우려, 시장 불확실성 확대 등으로 원유 수요가 감소할 것이라는게 이번 감산의 주요 이유다. 감산 폭은 2020년 4월 이후 가장 컸지만, 시장 예상 수준(50~200만 배럴/일)에 부합했기 때문에 감산 발표 후 유가의 상승 폭은 크지 않았다(10/5 WTI $87.76, +1.24%). OPEC은 2021년부터 매달 회의를 개최해 생산량을 정해왔는데, 금년 12월부터는 다시 기존 방식대로 6개월에 한번씩 회의를 열기로 했다. 원유 시장을 점검하고 생산량을 권고하는 JMMC(OPEC+ 합동 장관급 감시위원회)도 매달 열던 데서 두 달에 한 번씩으로 기간을 늘렸다."
29,22.10.07,물가 Peak-out 가능성 확대. 긍정적이지만 지나친 확..,"물가 Peak-out 가능성 확대. 긍정적이지만 지나친 확대 해석은 금물- 호주의 금리 인상 폭 완화와 임금 상승 둔화 기대감이 연준의 정책 변화를 가져올 수 있다는 기대감 형성- 실제로 Fed Watch에서는 2023년 12월로 예상했던 임금 인하 시기를 2023년 6월로 수정. 하지만 래피얼 보스틱, 메리데일리 등 연준 위원들은 조기 금리 인하가 없다는 발언을 이어가고 있는 상황. 시장에서 가지는 금리인하와 금리인상 기대감 변화가 경제지표 발표에 따라 지나치게 민감하게 움직이고 있다는 점에는 동의. 호주의 25bp 인상에 시장이 격하게 반응했듯이 금리 인상 우려가 확대된 9월은 Core CPI의 상승 하나만으로 격하게 반응. 어차피 연말까지 고물가 수준이 유지되고 연준 정책이 지속된다는 관점에서 경제지표 해석에 평정심을 찾을 필요성 존재- 다만 미국의 구인률 발표나 월세 가격 상승률 하락에서 확인되듯이 물가의 피크아웃 가능성은 조금씩 높아지고 있는것으로 판단. 특히 IMF는 WEO를 통해 물가상승의 큰 우려요인이었던 임금-가격 스파이럴 이론의 실현 가능성은 낮은것으로 발표. 일부 경제학자나 분석에서 주장하는 임금과 물가가 상호 작용하는 상승 구조의 배경에는 기업과 가계가 합리적이지 못해서 현재의 상황을 있는 그대로 받아들일 것이라는 가정을 전제로 함. 2022년 지속적으로 주장한 것과 같이 시장은 단기적으로만 비합리적이며 이미 임금 상승 둔화의 조짐이 발견되기 시작한 것은 긍정적"
>>>>>>> d94d1e5bc2617341817aaa91149fa23bbc08a09b
