,일자,제목,내용
0,21.11.12,교보박스 브리핑,"∙ OPEC, 4분기 원유 수요량 감소 예상- OPEC은 4분기 세계 원유 수요량을 지난달예상치보다 16만 배럴 낮춘 9,640만 배럴로 발표. 에너지 가격 상승으로 인해 수요가감소할 것으로 예상. 다만 내년 석유 수요는 올해보다 420만 배럴 증가한 1억600만배럴로, 2019년에 비해 50만 배럴이 증가할 것이라고 예상"
1,21.11.12,eBest Quant Daily,"<미국: 채권 시장 휴장 속 혼조>- 다우 : 35,921.23(-0.44%) / S&P500 : 4,649.27(0.06%) / 나스닥 : 15,704.28(0.52%)- 10월월간 재정수지는 1,651억 적자를 기록하며 예상치(-1,790억) 대비 적자폭이 작았고, 9월 도매재고는 +1.4% mom을 기록하며 예상치(+1.1%) 상회- 제약업체 오가논과 의류업체 테피스트리는 모두 예상치를 상회하는 매출액과 순이익 발표- 시진핑 주석이 아시아태평양 지역이 냉전으로 회귀해서는 안된다는 발언과 관련하여, 제이크 설리번 백악관 국가안보 보좌관은 미국과 중국은 신냉전이나 충돌이 아닌 자신들의 가치를 수호하며 경쟁하는 방향으로 나아갈 선택권이 있다고 발언- OPEC이 올해 원유 수요 전망을 일일 565만 배럴로지난달보다 16만 배럴 하향 조정하고 달러화가 강세를 보였음에도, 전일 하락에 따른 저가매수세가 유입되며 WTI유가는 전일대비 0.31% 상승한 81.59$/bbl을 기록- 재향군인의 날을 맞아 채권 시장이 휴장하고 주식시장 역시 거래가 많지 않았던 가운데, 반도체 업체 강세로 필라델피아 제조업지수와 나스닥은 상승했지만 달러 인덱스가 다시 상승하는 모습을보이고 유틸리티와 산업재가 약세를 보이면서 뉴욕 증시는 혼조세로 마감"
2,21.11.12,Start with IBKS,"- KOSPI는 글로벌 인플레이션 우려에 하락함. 미 소비자물가가 최고치를 기록하며 투자심리가 위축됨. 옵션만기일을 맞아 변동성 확대된 가운데 기관 순매도가 지수 하락을 주도. 엔씨소프트는 NFT를 활용한 게임 출시 계획 발표로 상한가를 기록하면서 관련주는 동반 강세기록. 전 거래일 대비 0.18% 하락한 2,924.92P로 마감- KOSDAQ은 업종 쏠림 현상 심화되며 상승함. NFT 연계 기대감에 게임주 상승지속. 테슬라 반등 및 전기차업체 리비안 상장으로 전기차 산업 기대감 커지며 2차전지 업종의 강세 지속. 전 거래일 대비 0.50% 상승한 992.65P로 마감"
3,21.11.11,교보박스 브리핑,"∙ 美 中, 기후변화 대응에 관한 공동선언 발표"
4,21.11.11,eBest Quant Daily,"<미국: 물가 상승과 달러화 강세 하락세>- 다우 : 36,079.94(-0.66%) /S&P500 : 4,646.71(-0.82%) / 나스닥 : 15,622.71(-1.66%)- 지난 주 신규실업수당 청구건수는 26.7만건을 기록하며 예상치(26.0만)를 상회했고, 10월 CPI는 +6.2% yoy를 기록하며 예상치(+5.9%)를 상회- 미국과 중국이기후변화 대응에 관한 공동 선언을 발표하고 실무 그룹을 꾸려 내년 상반기부터 가동해 2030년 전에 기후 대응을 확대할 예정이라고 전함- 미국 원유 재고가 3주 연속 증가하는 모습을 보이고, 물가와 시장금리 상승 영향에 달러화 역시 강세를 보이면서 WTI유가는 전일대비 3.3% 하락한 81.34$/bbl을 기록- 신규실업수당 청구건수가 팬데믹 이후 최저치를 경신했지만 예상치보다 높은 수준이었고, CPI가 예상보다 큰 폭으로 상승하면서 시장금리가 상승하고 달러화 강세로 이어진 점, 재향군인 기념일(Veterans day) 휴일을 앞둔 우려까지 더해지면서 뉴욕 증시는 하락세 마감"
5,21.11.11,Start with IBKS,"- KOSPI는 인플레이션 우려 부각되며 하락함. 미국, 중국의 높은 물가 지표 발표에 투자심리가 위축되며 기관과 외국인의 동반 순매도 나타남. 국채 금리 상승에 은행주가 강세를보였고, 전일 테슬라의 하락에 2차전지 관련주 역시 동반 하락함. 전 거래일 대비 1.09% 하락한 2,930.17P로 마감- KOSDAQ은 외국인과 기관의 순매도에 하락함. 메타버스 테마주 강세 지속된 가운데 글로벌 인플레이션 우려 부각되며 업종 전반이 약세를 기록.전 거래일 대비 2.07% 하락한 987.75P로 마감"
6,21.11.10,eBest Quant Daily,"<미국: CPI 발표 앞두고 하락세>- 다우 : 36,319.98(-0.31%) / S&P500 : 4,685.44(-0.35%) / 나스닥 : 15,886.54(-0.60%)-10월 NFIB 소기업 낙관지수는 98.2를 기록하며 예상치(99.5)를 하회하였고, 10월 PPI는 +8.6% yoy를 기록하며 예상치(+8.6%)에 부합- 주택건설업체 DR호튼은 예상치를 상회하는 매출액과 순이익을 발표했고, 제약 유통업체 카디널 헬스와 육류 가공업체 시스코는 예상치를 상회하는 매출액과 예상치를 하회하는 순이익 발표- 바이든 대통령은 다음 주 시진핑 국가주석과 화상 정상회담을 가질 예정이라고 전했으며, 최근 미-중 갈등이 이어지고 있는 가운데 북핵 기후변화 등에 대한 논의가 이루어질 것으로 전망됨- 매파 성향의제임스 불라드 세인트루이스 연은 총재는 미국 주택시장에 거품이 형성되어 있다고 지적하고,테이퍼링이 종료 이후 대차대조표 축소를 논의해야 한다고 발언- 전략 비축유 공급 가능성이제기되었지만, 오히려 공급 부족 상황이 심각하다는 인식으로 이어지며 WTI유가는 전일대비2.71% 상승한 84.15$/bbl을 기록- PPI가 지난달과 유사한 수준을 유지한 가운데 CPI 발표를 앞두고 경계감이 증가하고, 최근 상승에 다른 차익실현 매물 역시 출회되면서 뉴욕 증시는 하락세 마감"
7,21.11.10,Start with IBKS,"- KOSPI는 미국 정책 지원 기대감에 상승함. 앞서 미국의 인프라 투자 법안 통과에 따른 미 증시 호조 여파로 지수는 상승 출발. 이를 반영해 인프라 관련주 강세 나타남. 글로벌 인플레이션 우려 부각된 가운데 미국, 중국의 물가지표 발표를 앞둔 관망세로 지수 상승폭제한적. 전 거래일 대비 0.08% 상승한 2,962.46P로 마감- KOSDAQ은 업종별 차별화 나타나며 상승함. 미국 로블록스의 분기 호실적에 NFT, 메타버스 관련주 강세지속. 전일 화이자의 경구용 코로나19 치료제 관련 이슈로 하락했던 바이오 업종 내 저가매수세가 유입되며 지수는 상승함. 전 거래일 대비 0.62% 상승한 1,008.68P로 마감"
8,21.11.09,교보박스 브리핑,"∙ 클라리다 부의장, 금리인상 관련 발언- 리처드 클라리다 연준 부의장이 내년 말쯤에 기준금리를 인상하기 위한 세가지 필요조건이 충족될 것이라고 예견. 클라리다 부의장은 노동시장과글로벌 공급망이 조정됨에 따라 인플레이션 압력이 완화될 것으로 기대한다고 발언∙인프라 투자 관련주 강세- 미 의회의 1.2조 달러 인프라 투자 법안 통과로 인해 캐터필라 +4.07%, 벌칸 머티리어즈 +4.95%, 뉴코+3.60%, PAVE ETF +1.29% 등 관련 주식 및 ETF가 상승세를 띄는 모습"
9,21.11.09,eBest Quant Daily,"<미국: 인프라 법안 통과에도 성장주 약세에 강보합>- 다우 : 36,432.22(0.29%) / S&P500 : 4,701.72(0.09%) / 나스닥 : 15,982.36(0.07%)- 미국 10월 고용추세지수(ETI)는 112.23을 기록하며 전월(109.68)대비 상승- 제약업체 비아트리스는 예상치를 상회하는 매출액과 순이익 발표- 상원을 통과했던1.2조 달러 규모의 인프라 예산안이 5일 밤에 하원에서도 통과되며 바이든 대통령의 서명만이 남았는데, 바이든 대통령은 도로, 교량, 통신망 등 인프라를 현대화해 일자리를 창출하고 21세기 경쟁에서 승리하는 길로 인도할 것이라고 평가- 파월 의장은 컨퍼런스에서 팬데믹이 가장 견디기 힘든 사람들이 가장 큰 영향을 주면서 미국 내 불평등이 확대되었다고 언급하고, 이러한 불균형은 경제의 생산 능력에 부담을 주고 있다고 전함- 인프라 법안 통과 소식과 사우디 아라비아의 아시아 원유 판매 가격 인상 소식에 WTI유가는 전일대비 0.81%상승한 81.93$/bbl을 기록- 기업실적 발표와 경제지표 발표가 소강 상태를 보인 가운데 인프라 법안 통과 소식에 원자재 기업들이 강세를 보였음에도 불구하고, 시장금리 상승으로성장주 주가가 전반적으로 약세를 보이며 뉴욕 증시는 강보합 수준에서 마감"
10,21.11.09,Start with IBKS,"- KOSPI는 업종별 혼조세를 보이며 하락함. 화이자의 경구형 코로나19 치료제 개발 소식에 백신 관련 제약바이오주가 급락했으나 리오프닝 기대에 소비 및 항공 관련 업종은 상승.중국의 전력난 해소 기대감은 호재로 작용하며 지수 하단을 지지. 전 거래일 대비 0.31% 하락한 2,960.20P로 마감- KOSDAQ은 기관과 외국인의 동반 순매수에 상승함.화이자의 경구 치료제 소식에 따른 셀트리온 등 대형 제약바이오주의 약세에도 게임업계의 '플레이 투 언(P2E)'과 NFT 사업 진출 기대감으로 관련주 상승. 전 거래일 대비 0.11% 상승한 1,002.50P로 마감"
11,21.11.08,교보박스 브리핑,"∙ 美 하원, 1.2조 달러 인프라 예산 법안 통과- 미국 하원에서 도로, 교량, 수자원공급, 인터넷 통신망 등 낙후된 물적 인프라를 개선하고 일자리를 창출하기위해 1.2조 달러를 투입하는 인프라 예산 법안이 찬성 228, 반대 206표로 통과.하지만 아직 1.75조달러의 규모의 사회복지지출 예산 법안은 처리되지 않은 상황"
12,21.11.08,Start with IBKS,"- KOSPI는 미 고용 지표 주시 속 기관 매도세에 하락함. 연일 미 증시가 호조를 보인데 따라 증시는 상승 출발. 하지만 장 중 중국 부동산개발업체 자자오예의 디폴트 우려 소식이 악재로 작용하며 하락 반전. 기관이 대규모 순매도하며 지수 하락을 주도. 전 거래일대비 0.47% 하락한 2,969.27P로 마감- KOSDAQ은 외국인과 기관의 순매수 유입에 낙폭을 줄이며 약보합을 기록. 장초반 증시는 차익실현 매물에 크게 하락하다가 외국인과기관의 순매수 전환에 일부 낙폭 되돌림. 게임, 메타버스 관련주들은 주가 모멘텀을 받아상승세 이어가는모습. 전 거래일 대비 0.01% 하락한 1,001.35P로 마감"
13,21.11.05,교보박스 브리핑,"∙ BOE, 기준금리 동결 및 자산매입 프로그램 유지- 영국 중앙은행인 영란은행(BOE)에서 기준금리를 동결하고, 자산매입 프로그램을 유지. 이전 금리 결정까지는 만장일치였지만,이번 결정은 찬성 7 대 반대 2로 결정됨. BOE는 금리를 동결했으나 경제가 예상대로 성장한다면 몇 달 내 금리를 인상해야 할 수 있다고 밝힘. 또한, BOE는 자산매입 규모도8,750억 파운드로 유지"
14,21.11.05,eBest Quant Daily,"<미국: 반도체 강세에도 금융주 약세>- 다우 : 36,124.23(-0.09%) / S&P500 : 4,680.13(0.42%) / 나스닥 : 15,940.31(0.81%)- 지난 주 신규실업수당 청구건수는 26.9만건을 기록하며 예상치(27.5만) 대비 긍정적이었고, 9월 무역수지는 809억 달러 적자를 기록하며 예상치(-802억) 하회- 제약업체 조에티스, 바이오테크 업체 리제네론, 의료보험업체 시그나는 예상치를 상회하는 매출액과 순이익을발표했고, 바이오테크 업체 모더나는 예상치를 하회하는 매출액과 순이익 발표- 연말로 예정된 바이든 대통령과 시진핑 주석의 정상회담에서, 양국의 대립 지점 중 하나인 비자 발급 문제에 대한 합의가 이루어질 수 있다고 폴리티코가 보도- OPEC+회의에서 원유 생산량 증가에 대해 기존 방침을 유지하기로 결정했음에도, WTI유가는 전일대비 2.5% 하락한 78.81$/bbl을 기록- 신규 실업수당 청구가 다시 한번 팬데믹 이후 최저치를 경신한 가운데, 퀄컴, 엔비디아 등 반도체 업체가 강세를 보였음에도 시장금리 하락에 금융주가 약세를 보이면서 뉴욕 증시는 혼조세로 마감"
15,21.11.05,Start with IBKS,"- KOSPI는 완화적인 FOMC 결과를 소화하며 상승함. FOMC 내 테이퍼링 계획이 시장 예상에 부합한 가운데 금리 인상을 경계하는 파월 의장의 발언에 상승 출발. 중국의 장기적인 원전 건설 계획 발표에 관련주는 강세를 보임. 금리 변동과 인플레이션 우려가 잔존하며장 중 일부 상승폭을 되돌림. 전 거래일 대비 0.25% 상승한 2,983.22P로 마감- KOSDAQ은 차익실현 매물 출회되며 하락함. FOMC 이후 증시는 안도감을 형성하며,호실적을 기록한 2차전지 업종을 중심으로 상승. 최근 강세를 보인 게임주 위주의 차익실현매물에 지수는 하락함, 전 거래일 대비 0.36% 하락한 1,001.43P로 마감"
16,21.11.04,eBest Quant Daily,"<미국: FOMC 이후 상승세 전환>- 다우 : 36,157.58(0.29%) / S&P500 : 4,660.57(0.65%) / 나스닥 : 15,811.58(1.04%)- 10월ISM 서비스업 지수는 58.7을 기록하며 예상치(58.2)를 상회하였고, 10월 ADP취업자 변동은 57.1만건을 기록하며 예상치(40.0만) 상회- 제약 유통업체 CVS 헬스케어와 의료 서비스 업체 휴매나는 모두 예상치를 상회하는 매출액과 순이익을 발표했고, 크루즈 업체 노르웨이지안 크루즈 라인은 예상치를 하회하는 매출액과 순이익 발표- FOMC에서연준은 시장금리를 동결하고 1,200억 달러 규모의 자산 매입 프로그램을 축소하는 테이퍼링을 개시한다고 발표했는데, 11월과 12월에 매달 150억 달러씩 매입 규모를 줄인 후경제 전망에 따라 매입 속도를 조정할 것이라고 전함- 바이든 대통령이 원유 생산자들이 유가상승을 위해 생산을 보류하는 것은 옳지 않다고 발언하며 OPEC+회의를 앞두고 증산 가능성이 대두되고, 주간 원유재고 역시 증가하는 모습을 보이며 WTI유가는 전일대비 3.63%하락한 80.86$/bbl을 기록- 긍정적인 경제지표에도 FOMC 경계감과 유가 약세에하락세로 출발한 뉴욕 증시는, FOMC에서 파월 의장이 시장의 기대 수준의 테이퍼링을 발표하고 테이퍼링은 금리인상의 직접적인 신호는 아니라는 입장을 전하면서 시장이 안도하고 증시는상승세 전환에 성공"
17,21.11.04,Start with IBKS,"- KOSPI는 FOMC를 앞둔 경계심에 하락함. FOMC 결과를 앞두고 테이퍼링이 공식화될 것이란 전망에 달러가 강세를 보여 원/달러 환율 상승, 외국인과 기관의 동반 대규모순매도가 지수 하락을 주도. 카카오페이는 상장 첫 거래일 외국인 매도세에도 시초가 대비 7.22% 상승. 전 거래일 대비 1.25% 하락한 2,975.71P로 마감- KOSDAQ은업종별 차별화 나타난 가운데 하락함. 호실적을 보인 카카오게임즈, 위메이드를 중심으로 게임주는 강세 지속. 반면 엔터/미디어, 인터넷 업종은 차익실현 매물에 약세를 보임. 전 거래일 대비 0.44% 하락한 1,005.00P로 마감"
18,21.11.03,교보박스 브리핑,"∙ COP26, 2030년까지 메탄 배출량 30% 감축 합의- 제 26차 유엔기후변화협약당사국총회(COP26) 정상회의에서 약 100개국이 2030년까지 전세계 메탄 배출량의 30%를 감축하기 위해 노력하기로 합의. 지난 9월 미국과 EU가 공동으로 추진 계획을 발표한 국제메탄서약은 2030년까지 전 세계에서 배출되는 메탄 배출량을 2020년 대비 최소30% 줄인다는 목표를 가지고 있음.바이든 대통령은 COP26 기조연설에서 동참해달라고 호소하며 지난 9월 9개국 동참에서 이번에 100개국 가까이 서명을 한 상황"
19,21.11.03,eBest Quant Daily,"<미국: FOMC 경계감에도 3대지수 사상 최고치>- 다우 : 36,052.63(0.39%) / S&P500 : 4,630.65(0.37%) / 나스닥 : 15,649.60(0.34%)- 제약업체 화이자, 화장품 업체 에스티 로더, 에너지 기업 코노코필립스는 모두 예상치를 상회하는 매출액과 순이익 발표- 바이든 행정부는 UN 기후변화협약 당사국총회에 맞추어메탄 배출 감축을 위한 규제 계획을 발표했고, 미국 내 유정시설 30만곳에서 3개월마다점검을 해 원유 부산물로 생기는 메탄 배출을 줄이는 등의 규제 계획을 전함- S&P500기업 중 320개 업체가 실적을 발표한 가운데, 실적 발표 기업의 약 80%가 예상치를 상회하는 EPS를 발표했고 순이익은 40.2% yoy 증가할 것으로 추정치가 형성- 4일로예정된 OPEC+ 회의를 앞둔 불확실성에, WTI유가는 전일대비 0.2% 하락한 83.91$/bbl을 기록- 테이퍼링 발표를 하루 앞둔 경계감에 뉴욕 증시는 혼조세로 출발했지만,공급망 이슈와 임금, 원자재 가격 상승 우려에도 기업들이 긍정적인 실적 이익률을 기록하고있다는 평가에 장 중 상승 폭을 확대하고 3대지수는 모두 사상 최고치를 경신"
20,21.11.03,Start with IBKS,"- KOSPI는 반도체 산업 우려 완화로 상승함. 미 필라델피아 반도체 지수 호조 속반도체업황 둔화 우려 완화되며 삼성전자 등 반도체주에 대한 투자심리 개선됨.전일 테슬라 급등여파로 2차전지, 자동차 업종이 강세를 보임. 전 거래일 대비1.16% 상승한 3,013.49P로 마감- KOSDAQ은 기관과 외국인의 동반 순매수에 상승함. 최근 강세를 보였던게임주는 차익실현 매물이 출회되며 약세. 전 거래일 대비 1.09% 상승한 1,009.44P로 마감"
21,21.11.02,교보박스 브리핑,"∙ 바이든 대통령, COP26에서 기후변화 대응 계획 제시- 바이든 대통령이 유엔기후변화협약 당사국회의(COP26)에서 공격적인 목표를 담은 기후변화 대응 계획을 제시. 넷제로를달성하기 위하여 2030년까지 온실가스 배출량을 2005년 대비 50~52% 수준으로 줄이고 2035년까지 전력 발전 부분 탄소 배출량을 제로로 만들겠다는 중간 목표를 내놓은 상황"
22,21.11.02,eBest Quant Daily,"<미국: FOMC 경계감에도 상승세 지속>- 다우 : 35,913.84(0.26%) / S&P500 : 4,612.15(0.15%) / 나스닥 : 15,595.92(0.63%)-10월 ISM 제조업지수는 60.8을 기록하며 예상치(60.5) 상회- 자산운용사 프랜클린리소시스는 예상치를 상회하는 매출액과 순이익 발표- UN기후변화협약 당사국 회의에 참석한바이든 대통령은 2030년까지 온실가스 배출량을 2005년 대비 50% 수준으로 감축하는공격적인 계획을 제시- S&P500기업의 절반 이상이 실적을 발표한 가운데, 블룸버그는80%의 기업이 예상치를 상회하는 실적을 기록했으며 실적 발표 이후 S&P500 지수는 6% 가까운 상승세를 기록하며 최근 7년 실적 발표 기간 중 가장 강한 모습을 보였다고 평가- 이번주 OPEC+회의에서 현재 수준의 산유량을 유지할 것이라는 전망에 WTI유가는 전일대비 0.6% 상승한 84.05$/bbl을 기록- ISM 제조업지수가 예상보다 긍정적인 수치를 기록하고 실적 기대감 역시 이어지며 뉴욕 증시는 다시 한번 사상최고치를 경신했으나,이번주 FOMC를 앞두고 증시는 상승폭이 제한적인 모습을 기록"
23,21.11.02,Start with IBKS,"- KOSPI는 미 증시 강세 및 수출입 지표 호조로 상승함. 지수는 전일 사상 최고치를보인 미국 증시의 영향을 받아 상승 출발. 이번 주 FOMC를 앞두고 경계심이 짙은 가운데한국 수출입 지수가 호조를 보이며 투자심리 개선. 전 거래일 대비0.28% 상승한 2,978.94P로 마감- KOSDAQ은 게임 업종 주도로 상승함. 카카오게임즈는 흥행작 오딘개발사 인수소식에 상승했으며, 게임과 NFT의 결합 기대감에 여타 관련주들이 강세를 보임.전거래일 대비 0.63% 상승한 998.57P로 마감"
24,21.11.01,Start with IBKS,"- KOSPI는 금리 상승 및 미국 주요 기업의 실적 부진에 하락함. 전일 발표된 아마존과애플의 실적이 시장 예상치를 하회하며 투자심리가 위축됨. 국내 금리가 중단기물 위주로 크게 상승한 점도 밸류에이션 부담 확대 요인으로 작용하며 지수 하락을 견인. 전 거래일 대비1.29% 하락한 2,970.68P로 마감- KOSDAQ은 기관 순매도에 하락함. 정부의경구용 코로나19 치료제 선구매 소식에 셀트리온 관련주는 약세를 보이며 지수 하락을 주도. 메타버스 수혜 기대감 속 위메이드는 강세를 보임. 전 거래일 대비 0.78% 하락한 992.33P로 마감"
25,21.10.29,교보박스 브리핑,"전일 주요국 증시 이슈∙ 美 3분기 GDP성장률 2%- 미국 실질 국내총생산(GDP) 증가율(속보치)이 전기 대비 연율 2.0% 기록. 지난 2분기 성장률인 6.7%에서많이 하회하는 상황. 델타 변이 확산으로 인한 소비지출 감소와 노동력과 원자재 부족으로 감소한 모습. 특히 개인소비 증가율이 2분기 12%에서 3분기 1.6%로 감소∙ ECB 금리동결- 유럽중앙은행(ECB)가 기준금리를 0%로 동결했으며, 팬데믹긴급매입프로그램(PEPP)의 채권 매입속도도유지하기로 결정. 채권 매입규조는 2022년 3월 말까지 1조8,500억 유로로 유지될 예정. 라가르드 총재는 물가상승률이 다시 하락하는데 예상보다 시간이 더 걸릴 것으로 보이지만, 중기적으로는 목표치인 2%이하에서 유지될 것으로 본다고 언급"
26,21.10.29,eBest Quant Daily,"<미국: 성장주 강세에 상승세>- 다우 : 35,730.48(0.68%) / S&P500: 4,596.42(0.98%) / 나스닥 : 15,448.12(1.39%)- 지난 주 신규실업수당 청구건수는 28.1만건을 기록하며 예상치(28.8만)를 하회하였고, 3/4분기연율화 GDP 속보치는 +2.0% qoq를 기록하며 예상치(+2.6%) 하회- 기계업체 캐터필라와 음식료 업체 얌브랜즈는 모두 예상치를 상회하는 매출액과 순이익을 발표했고, 방산업체 노스럽 그루만과 양조 업체 몰슨쿠어스는 예상치를 하회하는 매출액과 예상치를 상회하는 순이익 발표- 바이든 대통령은 기존 3.5조 달러 규모의 사회한전망 예산을 1.75조 달러로삭감한 새로운 방안을 제시하고 의회의 조속한 처리를 촉구- 원유 선물의 허브인 오클라호마쿠싱의 원유 재고가 감소했다는 평가에, WTI유가는 전일대비 0.18% 상승한 82.81$/bbl을 기록- 신규실업수당 청구가 팬데믹 이후 최저치를 경신하고, 부진한 GDP는 오히려 테이퍼링 속도가 빠르지 않게 될 것이라는 긍정적인 평가가 퍼지면서 뉴욕 증시는 상승세를 기록했고 S&P500과 나스닥은 사상 최고치를 경신"
27,21.10.29,Start with IBKS,"- KOSPI는 글로벌 불확실성 확산 여파로 하락함. 삼성전자 3분기 역대 최고 실적 달성소식에 반도체 업종은 강세를 보였지만 미 증시 차익실현 출회, 중국발 리스크 여파로 불안감 확대됨. 외국인과 기관은 연일 순매도에 나서며 지수 하락을 견인. 전 거래일 대비 0.53% 하락한 3.009.55P로 마감- KOSDAQ은 차익실현 매물 출회되며 하락함. 대외 불확실성에 투자심리 악화된 가운데 미디어콘텐츠 관련주를 중심으로 차익실현 매물 출회.전 거래일 대비 0.87% 하락한 1,000.13P로 마감"
28,21.10.28,교보박스 브리핑,"∙ 머크, 먹는 코로나19 바이러스 치료제 복제 허용- 미국 제약사 머크가 먹는 코로나19바이러스 치료제를 제3세계 등에 보급하기 위해 다른 제약사가 복제할 수있도록 허용. 유엔의 후원을 받는 의료 단체인 의약품 특허풀(MPP)이 먹는 바이러스 억제제 몰누피라비와 같은효능을 지닌 복제약 제조를 위해 머크와 특허 사용 계약을 맺은 상황∙ BOC, 기준금리동결 및 양적완화 종료- 캐나다 중앙은행(BOC)가 기준금리인 오버나이트 금리를 0.25%로 동결했으며, 매주 20억 달러씩 매입하던양적완화 프로그램을 종료. 만기가 도래하는 채권에 대해서만 재투자를 하여 순매입이 없도록 할 예정∙"
