,일자,제목,내용
0,21.10.22,교보박스 브리핑,"전일 주요국 증시 이슈∙ 美 국채 금리 급등- 전일 미국 국채 10년물은 +4.44bp 상승하여 1.70%로 마감. 또한 단기물인 2년물도 +6.91bp 상승하여 0.45%로 마감하는 모습. 최근 베이지북, 연준 이사 등의 발언으로 인플레이션에 대한 우려 확대 영향으로 보임∙ 애틀란타 연은 총재, 금리인상 관련 발언- 라파엘 보스틱 애틀란타 연은 총재는 연준이 2022년 3분기 말이나 4분기 초에 금리 인상을 할 수 있을 것 같다고 발언. 보스틱 총재는 인플레이션 압력이 일시적이라는 다른 연준 이사들의 견해를 반박하면서 이는 예상보다 더 오래 지속될 것이라고 말함"
1,21.10.22,eBest Quant Daily,"<미국: 에너지 기업 약세에도 실적 호조에 혼조>- 다우 : 35,603.08(-0.02%) / S&P500 : 4,549.76(0.30%) / 나스닥 : 15,215.70(0.62%)- 지난 주 신규실업수당 청구건수는 29.0만건을 기록하며 예상치(29.7만) 대비긍정적이었고, 10월 필라델피아 제조업지수는 23.8을 기록하며 예상치(25.0) 하회-9월 컨퍼런스보드 경기선행지수는 +0.2% mom을 기록하며 예상치(+0.4%)를 하회하였고, 9월 기존주택매매는 629만건을 기록하며 예상치(610만) 상회- IT 기업 인텔과항공업체 아메리칸 에어라인은 모두 예상치를 상회하는 매출액과 순이익을 발표하였고, 통신업체AT&T는 예상치를 하회하는 매출액과 예상치를 상회하는 순이익 발표- 연준은 연은 총재12명과 연준 이사 7명 등 고위급 인사들의 개별 주식 보유를 금지하고, 뮤추얼펀드와 같은금융 상품의 경우에는 제약을 강화- 천연가스 재고가 상승했다는 소식과 달러화 강세 영향에WTI유가는 전일대비 1.1% 하락한 82.50$/bbl을 기록- 헝다그룹 파산 우려가재부각되며 뉴욕 증시는 하락세로 출발했지만, 기업이익에 대한 낙관적인 입장과 팬데믹 이후가장 낮은 수준의 신규실업수당 청구건수가 이어지면서 뉴욕 증시는 낙폭을 회복하고 혼조세 마감"
2,21.10.22,Start with IBKS,"- KOSPI는 헝다그룹 리스크가 다시 불거지면서 하락함. 중국 헝다그룹의 이자지급 유예기한인 23일이 다가오면서 디폴트 우려가 재점화됨. 인플레이션 압력도 이어지면서 증시 하락을 견인함. 전 거래일 대비 0.19% 하락한 3,007.33P로 마감- KOSDAQ은 글로벌 불안요인들이 지속되는 가운데 하락함. 외국인과 기관은 순매도를 지속하면서 증시 하락견인. 전 거래일 대비 0.79% 하락한 993.70P로 마감"
3,21.10.21,교보박스 브리핑,"전일 주요국 증시 이슈∙ Fed 베이지북 발표- 미국 연준은 경기 평가 보고서인 베이지북에서 경제활동이 보통의 속도에서 완만한 속도로 증가했지만, 일부지역에서 공급망 차질, 노동력 부족과 델타 변이의 불확실성으로 성장 속도가 둔화됐다고 평가. 또한 물가 압박은 운송과 노동 제약, 원자재 부족 등으로 발생했으며 많은 기업이 강한 수요로 비용 전가 능력이 커졌다고 평가∙ 中, 미국 벤처글로벌과 LNG 대량 수입 계약- 최근 전력난 위기에 처한 중국이 국유기업인 중국석유화공그룹을 통해 미국 벤처글로벌과 매년 400만 톤의 액화천연가스(LNG)를 20년간 도입하는 계약에 합의. 중국은 미국으로부터 작년 기준 310만 톤을 수입. 이 계약으로 기존의 2배 이상을 수입하게 될 예정"
4,21.10.21,eBest Quant Daily,"<미국: 실적 호조에도 공급망 우려에 혼조>- 다우 : 35,609.34(0.43%) /S&P500 : 4,536.37(0.37%) / 나스닥 : 15,121.68(-0.05%)- 연준은 베이지북에서 최근 몇 주간 경제 활동은 보통 수준의 증가를 기록하고 있지만, 대부분의 지역에서 성장 속도는 느려지고 있고 공급망 병목 현상과 노동력 부족이 원인이었다고평가- 바이오테크 업체 바이오젠과 보험업체 앤섬은 예상치를 상회하는 매출액과 순이익을 발표했고, 통신업체 버라이즌은 예상치를 하회하는 매출액과 예상치를 상회하는 순이익 발표- S&P500 포함 기업의 14%가 실적을 발표한 가운데, 레피니티브는 현재 S&P500의 이익은 33% yoy증가할 것으로 전망치가 형성되어 있으며 현재 85%의 기업이 예상치를 상회하는 실적을 발표했다고 전함- 미국 원유재고가 예상과 다르게 감소하고 달러화 역시 약세를보이면서, WTI유가는 전일대비 1.2% 상승한 83.87$/bbl을 기록- 기업 실적 호조에 뉴욕 증시는 상승세로 출발했지만, 기업들의 실적 발표에 이어 베이지북에서도 공급망에대한 우려를 전하면서 증시는 장 중반 이후 상승폭을 반납하고 혼조세로 마감"
5,21.10.21,Start with IBKS,"- KOSPI는 경기 둔화 우려 속 외국인, 기관의 순매도세 전환으로 하락함. 전일 미국증시 호조에 따른 투자심리 개선으로 장초반 강세를 보였으나 철강, 기계 업종을 중심으로 대규모 차일식현 매물이 출회됨. IMF의 올해 아시아태평약 지역 GDP 성장률 전망치 하향조정 소식도 증시에 부정적으로 반영. 전 거래일 대비 0.53% 하락한 3,013.13P로마감- KOSDAQ은 차익실현 매물 출회 속 외국인, 기관의 4영업일 연속 순매도에 하락함. 전 거래일 대비 0.37% 상승한 1,001.62P로 마감"
6,21.10.20,교보박스 브리핑,"전일 주요국 증시 이슈∙ 리치먼드 연은 총재, 노동력 공급 부족 관련 발언- 토마스 바킨 리치먼드 연은 총재는 연례 인력개발 심포지엄 연설에서 미국의 노동력 공급 부족사태가 경제 성장을 제약할 수 있다고 언급. 또한, 바킨 총재는 노동 부족 현상이 팬데믹이 끝난 후에도 더 오래 지속될 것이라고 발언∙ IMF, 아시아 태평양 지역 경제성장률 전망치 하향- 국제통화기금(IMF)에서 아시아 태평양 지역의 올해 경제성장률 전망치를 6.5%로 하향 조정. IMF 아시아태평양 담당국장은 코로나 델타 변이 확산과 글로벌 공급망 쇼크 등을 들어 성장률이 하향됐다고 밝힘. IMF 기준상아시아태평양은 중동과 중앙아시아 등을 제외하고 한국, 중국, 일본, 몽골, 동남아 지역등을 포함∙"
7,21.10.20,eBest Quant Daily,"<미국: 실적 호조 지속에 상승세>- 다우 : 35,457.31(0.56%) / S&P500 : 4,519.63(0.74%) / 나스닥 : 15,129.09(0.71%)- 9월 주택착공은 155.5만건(-1.6% mom)을 기록하며 예상치(161.5만, +0.0% mom)를 하회하였고, 건축허가는 158.9만건(-7.7% mom)을 기록하며 예상치(168.0만, -2.4% mom) 하회- 담배업체 필립모리스와 생활용품 업체 P&G는 예상치를 상회하는 매출액과 순이익을 발표했고, 제약업체 J&J와 에너지 기업 할리 버튼은 예상치를 하회하는 매출액과 예상치를 상회하는 순이익 발표- BofA는 글로벌 펀드매니저를 대상으로 한서베이 결과 응답자의 34%가 내년 스태그플레이션이 발생할 것으로 응답하며 10년만에 가장 높은 비율을 기록했다고 전함- 미국에 도창하는 컨테이너 하역 작업의 40%를 처리하는LA와 롱비치항 입항을 기다리는 화물선이 157척을 기록하며 역대 최대치를 경신- 푸틴 대통령이 유럽에 천연가스 공급을 늘리겠다고 발언했지만 실제로 운송 예약이 이루어지지 않았다는소식에 공급 우려가 이어졌고, WTI유가는 전일대비 0.6% 상승한 82.96$/bbl을기록- 주택지표가 부진하고 시장금리가 상승했음에도, 지금까지 실적을 발표한 S&P500기업의 82%가 예상치를 상회하는 실적을 발표하는 등 긍정적인 실적이 이어지면서 뉴욕 증시는 상승세로 마감"
8,21.10.20,Start with IBKS,"- KOSPI는 기업 실적 기대로 상승함. 원/달러 환율 안정세 속 미국 대형 기술주 호실적 기대로 대형주를 중심으로 외국인, 기관의 순매수가 유입되며 지수 상승을 견인. 전 거래일 대비 0.74% 상승한 3,029.04P로 마감- KOSDAQ은 개인 순매수로 상승함.테슬라와 넷플릭스의 실적 기대감에 2차전지와 미디어 콘텐츠 섹터가 연일 강세를 보임. 전거래일 대비 1.16% 상승한 1,005.35P로 마감"
9,21.10.19,교보박스 브리핑,"∙ 中 경제지표 발표- 중국 3분기 GDP성장률이 예상치 +5.0 YoY%와 전분기 +7.9 YoY%를 하회하는 +4.9 YoY%를 기록. YoY기준 올해 1분기 18.3%로 최고점을 찍은후 2분기 7.9%, 3분기 4.9% 하락하는 모습을 보이고 있음. 산업생산은 지난달 +5.3 YoY% 를 하회하는 +3.1 YoY%, 소매판매는 지난달 +2.5 YoY%를 상회하는 +4.4 YoY% 기록∙ 美 경제지표 발표- 미국 9월 산업생산은 지난달 -0.1 MoM%와 예상치 +0.1 MoM%를 하회하는 -1.3 MoM% 기록. 미국 10월주택시장지수는 지난달 76과 예상치 75를 상회하는 80을 기록∙"
10,21.10.19,eBest Quant Daily,"<미국: 중국 성장률 부진 우려에도 기술주 중심의 반등>- 다우 : 35,258.61(-0.10%) / S&P500 : 4,486.46(0.34%) / 나스닥 : 15,021.81(0.84%)- 9월 광공업생산은 -1.3% mom을 기록하며 예상치(+0.1%)를 하회하였고, 설비가동률은 75.2%를 기록하며 예상치(76.4%) 하회- 10월 NAHB 주택시장지수는 80을 기록하며 예상치(75) 상회- 금융업체 스테이스 스트릿은 예상치를 하회하는매출액과 예상치를 상회하는 순이익 발표- 랜달 퀼스 연준 부의장은 디지털 자산이 현재는글로벌 금융 안정에 영향을 주지 않지만, 규제의 틈새에 있는만큼 향후 체계적 위험으로 발전할 가능성이 있다고 지적- CNBC는 현재 미국 상위 10%가 보유한 주식 비율이 89%로사상 최대 규모를 기록했고, 코로나19 대유행이 부의 불평등을 키웠다고 지적- 수요기대감이 이어지는 가운데 공급망 문제 우려가 이어지면서, WTI유가는 전일대비 0.2% 상승한82.44$/bbl을 기록- 중국 성장률이 부진한고 인플레이션 우려가 이어지며 뉴욕 증시는하락세로 출발했지만, 1.6%를 넘어섰던 10년물 국채금리가 안정되는 모습을 보이고 애플의 신제품 소식과 이번 주 실적을 발표하는 기업들의 기대감까지 더해지면서 증시는 나스닥을중심으로 상승세 마감"
11,21.10.19,Start with IBKS,"- KOSPI는 중국 GDP 성장률 주시 속 경기 둔화 우려에 하락함. 중국 3분기 GDP성장률 부진으로 투자심리가 위축됐으나 미국과 중국의 소비 지표가 견고한 데 따라 외국인이장 중 순매수로 전환하며 일부 낙폭을 되돌림. 전 거래일 대비 0.28% 하락한 3,006.68P로 마감- KOSDAQ은 개별 업종 기대감에 상승함. 2차전지 기업 호실적 기대감과 디즈니+의 한국 오리지널 콘텐츠 강화 소식에 관련주가 강세를 보임. 전 거래일 대비 0.34% 상승한 993.86P로 마감"
12,21.10.18,교보박스 브리핑,"∙ 美 11월 8일부터 외국인 입국 가능- 코로나19 백신 접종을 마친 외국인들은 11월8일부터 미국에 입국 가능. 미국으로 가는 교통편에 탑승하기 전에 백신 접종 증명서와 72시간 이내에 받은 코로나19 음성 증명서를 제시해야 함. FDA가 승인한 화이자, 모더나,얀센 백신과 WHO가 인정한 아스트라제네카 등이 코로나19 백신으로 인정 받을 수 있음"
13,21.10.18,eBest Quant Daily,"<미국: 긍정적인 실적 속 상승세>- 다우 : 35,294.76(1.09%) / S&P500 : 4,471.37(0.75%) / 나스닥 : 14,897.34(0.50%)- 10월뉴욕 제조업지수는 19.8을 기록하며 예상치(25.0)를 하회하였고, 9월 소매판매(자동차및 연료 제외)는 +0.7% mom을 기록하며 예상치(+0.4%) 상회- 10월 미시건대소비자 신뢰지수 예비치는 71.4를 기록하며 예상치(73.1) 하회- 투자은행 골드만 삭스, 찰스슈왑과 운송업체 JB헌트는 모두 예상치를 상회하는 매출액과 순이익을 발표- 백악관은 11월 8일부터 코로나19 백신 접종을 완료한 해외 여행객들의 미국 입국을 허용할 것이라고 발표하고, 이번 조치는 항공 및 육로 여행 모두에 해당한다고 전함- 국제에너지기구(IEA)가 원간 석유보고서에서 석유 수요가 증가할 것이라고 전망하면서 WTI유가는 전일대비1.2% 상승한 82.28$/bbl을 기록- 경제지표는 엇갈린 모습을 보였지만 소매판매가긍정적으로 발표된 점을 투자자들이 긍정적으로 평가하고, 긍정적인 기업 실적이 이어지고 시장금리가 상승한 점이 금융주 주가에 우호적으로 작용하며 뉴욕 증시는 상승세로 마감"
14,21.10.18,Start with IBKS,"- KOSPI는 외국인, 기관 동반 매수세로 상승함. 미국 실업 지표 개선 속 미 기업 호실적과 원/달러 환율 상승세 진정에 투자심리가 회복되며 외국인 9영업일 만에 순매수로 전환. 대만 반도체 업체 TSMC의 3분기 호실적 및 4분기 실적 가이던스가 상향에 반도체주가강세를 보이며 증시 상승을 주도. 전 거래일 대비 0.88% 상승한 3,015.06P로마감- KOSDAQ은 미 증시 호조에 투자심리 회복되며 상승함. 인플레이션 우려 속 미 기업들의 실적 성장, 정부 주도 하 공급난 해결 기대로 투자심리가 개선됨. 전 거래일 대비0.72% 상승한 990.54P로 마감"
15,21.10.15,교보박스 브리핑,"∙ 美 상원 빅테크 규제 입법안 추진- 미국 민주당 에이미 클로버샤 상원 반독점 소위 위원장과 공화당 척 그래슬리 상원 의원이 아마존, 애플, 페이스북, 구글의 자체 특혜 행위에제동을 걸기 위한 법안을 발의한다고 알려짐. 관련법은 이미 하원에서 진행중이며 상원에서도발의가 추진되는 상황. 법안은 IT대기업이 규제 조항을 위반할 경우 이에 따른 수익의 15%를 벌금에 부과하는 등 강력한 조항을 포함"
16,21.10.15,eBest Quant Daily,"<미국: 실적 및 경제지표 호조에 상승>- 다우 : 34,912.56(1.56%) / S&P500 : 4,438.26(1.71%) / 나스닥 : 14,823.43(1.73%)- 지난 주 신규실업수당 청구건수는 29.3만명을 기록하며 예상치(32.0만)를 하회하였고, 9월 PPI는 +8.6% yoy를 기록하며 예상치(8.7%) 하회- 은행 업체 시티그룹, 뱅크 오브 아메리카, 웰스파고와 투자은행 모건스탠리는 모두 예상치를 상회하는 매출액과 순이익발표- IMF는 공동성명에서 정책 초점을 위기 대응에서 성장 촉진, 재정의 장기 지속 가능성으로 전환할 필요성이 있다고 언급하고, 각국 중앙은행은 원자재 가격 상승과 공급망 교란속에서 인플레이션 경계심을 가져야 한다고 전함- 제임스 불라드 세인트 루이스 연은 총재는노동시장이 타이트한 가운데 인플레이션의 상승이 일시적인 것이 아니라 좀 더 장기화될 가능성이 있으며, 소멸 가능성과 지속 가능성이 각각 50과 50의 확률이라고 평가- 주간 원유재고가 예상보다 큰 폭으로 증가했음에도 불구하고, 국제에너지기구(IEA)가 올해와 내년 수요가 개선될 것이라고 전망하고 달러화 역시 약세를 보이면서 WTI유가는 전일대비 1.1%상승한 81.31$/bbl을 기록- 신규실업수당 청구건수가 팬데믹 이후 가장 낮은 수준까지하락하고 금융 업종 기업 실적이 전반적으로 긍정적으로 발표되며 상승세로 출발한 뉴욕 증시는 시장금리 하락으로 인한 IT 업종 반등까지 더해지며 장 중 상승세를 유지"
17,21.10.15,Start with IBKS,"- KOSPI는 글로벌 불확실성 완화 기대로 상승함. 전일 백악관의 글로벌 공급난 대책회의를 위한 민간기업 소집과 에너지 부족에 대한 해결 방안 논의 소식에 투자심리가 개선됨. 정부의 환율 정책 개입 발언에 원/달러 상승 우려가 진정된 부분도 긍정적으로 작용. 대형주를중심으로 한 기관의 대규모 순매수가 지수 상승을 견인. 전 거래일 대비 1.50% 상승한2,988.64P로 마감- KOSDAQ은 연일 기관과 외국인의 동반 순매수로 상승함. 전거래일 대비 3.14% 상승한 983.43P로 마감"
18,21.10.14,"나스닥, 높은 인플레이션 불구 어닝시즌에 주목하며 ..",미 증시 동향- 미 증시는 본격적인 실적 시즌이 시작되며 상승 출발했으나 실적 발표된 금융주와 항공주 중심으로 매물이 출회되며 낙폭을 확대하기도 했음- 그러나 소비자 물가지수 발표 후 백악관에서 인플레이션 상승세가 둔화되고 있다고 주장 후 낙폭울 축소하거나 상승세를 기록하는 모습을 보여줌- 이후 개별적인 호재가 유입된 기술주의 강세로 나스닥은 견고함을 보인 후 상승 마감
19,21.10.14,교보박스 브리핑,"전일 주요국 증시 이슈∙ 9월 FOMC 의사록 공개- 지난 9월 21~22일에 열린 FOMC 의사록에서 다음번 회의에서 테이퍼링을 결정한다면 11월 중순이나 12월중순경 테이퍼링을 시작할 수 있다는 내용이 포함됨. 구체적인 자산 매입 속도는 월마다 미국채 100억 달러,MBS 50억 달러씩 축소해 나가는 경로를 제시∙ 바이든, 물류대란으로 항만 운영시간 연장- 바이든 대통령은 서부 LA항을 24시간 연장 운영하는 방안 마련. 미국 서부 LA항과 롱비치항 미국으로 들어오는 컨테이너 수송의 40%를 차지. 롱비치항은 이미 3주전부터 부분적으로 24시간 운영에 들어간 상황. 또한, 월마트, 페덱스 등 대형 유통 및 수송업체도 상품 운송 속도를 높이기 위해 24시간 운영에 들어감∙"
20,21.10.14,eBest Quant Daily,"<미국: 장기채 금리 안정에 반등 흐름>- 다우 : 34,377.81(-0.00%) / S&P500 : 4,363.80(0.30%) / 나스닥 : 14,571.63(0.73%)-9월 CPI는 +5.4% yoy를 기록하며 예상치(+5.3%) 상회- 이 날 공개된 9월FOMC 의사록에 따르면, 연준 위원들은 11월 중순이나 12월 중순에 테이퍼링을 시작해매달 약 150억 달러(국채 100억, MBS 50억)씩 매입 규모를 줄여 8개월에 걸쳐테이퍼링을 진행하는 방법을 논의했으나 일부 위원들은 더욱 빠른 속도를 주장- 은행업체 JP모건, 자산 운용사 블랙락, 항공 업체 델타는 모두 예상치를 상회하는 매출액과 순이익 발표- 바이든 대통령은 트럭 노조, 상공회의소 관계자들과 회의를 하고 서부 항만의 물류 대한완화를 위한 대응책을 발표할 것이라고 전함- OPEC이 월간 보고서에서 원유 수요를 소폭하향 조정하면서 WTI유가는 전일대비 0.3% 하락한 80.44$/bbl을 기록- 기업 실적이 전반적으로 긍정적이었음에도 CPI가 예상보다 높게 발표되면서 시장금리가 상승하고 뉴욕증시는 하락세로 출발했지만, 장중 시장금리가 안정되고 FOMC 의사록에서 11월에 테이퍼링을 시작해 내년 중반에 종료한다는 시장의 기대치와 비슷한 수준의 속도가 공개된 점 역시안도감을 주면서 뉴욕 증시는 나스닥을 중심으로 반등에 성공"
21,21.10.14,Start with IBKS,"- KOSPI는 연일 약세에 따른 저가 매수세에 상승함. 시장 불안감이 지속되며 최근 조정폭 컸던 대형주 및 자동차 업종을 중심으로 기관의 저가 매수세가 유입. 미국의 9월 소비자물가 발표를 앞둔 경계심에 장 중 지수 상승폭 일부 되돌림. 전 거래일 대비 0.96% 상승한 2,944.41P로 마감- KOSDAQ은 기관과 외국인의 동반 순매수에 상승함. 전거래일 대비 1.42% 상승한 953.47P로 마감"
22,21.10.13,"한국 증시, 반발 매수 유입되며 상승","- 한국 증시, 전일 급락에 대한 반발 매수 유입되며 반등. 기관 순매수 및 외국인의 선물매수 확대 또한 지수 상승에 긍정적으로 작용- 시가총액 상위 종목 대부분 상승하는 가운데, 전일 반도체 업황 우려로 급락했던 삼성전자, SK하이닉스 소폭 반등. 차량용 반도체 부족 완화 기대감으로 현대차, 기아 등 자동차 관련주 상승- 달러/원 환율은 장초반 1200원대 근접한 이후, 지수 상승하며 하락 전환. 다만, 여전히 1190원선 상회하고, 글로벌인플레이션 우려 등으로 환율 변동성 지속될 것으로 전망"
23,21.10.13,교보박스 브리핑,"∙ IMF, 세계 GDP성장률 하향 조정- 국제통화기금(IMF)가 올해 세계 GDP성장률을6.0%에서 5.9%로 -0.1%p 하향 조정. 또한, 미국 7.0%에서 6.0%로 -1.0%p, 중국 8.1%에서 8.0%로 하향 조정. 한국은 지난 7월 3.6%에서 4.3%로 0.7%p 상향 조정 후 이번에는 4.3% 그대로 유지∙ 애틀란타 연은 총재, 인플레이션 관련 발언- 라파엘 보스틱 애틀란타 연은 총재가 인플레이션 상승세가 예상보다 오래 지속될 것이며, 테이퍼링이 시작되더라도 경제에 부정적인 영향은 예상하지 않는다고 발언. 현재의인플레이션에도 연준 금리인상은 여전히 1년이상 걸릴 것. 또한, '일시적'이라는 단어는'짧은 기간'이라는 의미가 아닌 '사라지는 경향이 있다'라는 의미라고언급"
24,21.10.13,eBest Quant Daily,"<미국: 어닝 시즌 경계감과 인플레 우려에 3거래일 연속 하락>- 다우 : 34,378.34(-0.34%) / S&P500 : 4,350.65(-0.24%) / 나스닥 : 14,465.92(-0.14%)- 9월 NFIB 소기업 낙관지수는 99.1을 기록하며 예상치(99.5)를 하회- IMF는 전세계 경제성장률 전망치를 7월의 6.0%에서 5.9%로 하향 조정하고, 선진국과 신흥국의 회복 격차가 크고 글로벌 공급망 차질로 경제 모멘텀이 둔화되고있다고 평가- 라파엘 보스틱 애틀랜타 연은 총재는 인플레이션이 예상보다 오래 지속되고 있어일시적인 상승이라고 언급하는 것은 적절하지 않다고 평가하고, 장기 인플레이션 기대가 목표치에서 벗어나지 않는지 면밀히 상황을 지켜볼 것이라고 전함- 중국과 인도에서 연말까지 전력난이 지속될 것이라는 전망과 공급 부족 우려가 이어지면서, WTI유가는 전일대비 0.2%상승한 80.64$/bbl을 기록- 대형 은행주들의 기업실적 발표와 FOMC 의사록 공개를앞둔 경계감에 투자자들이 관망하는 모습을 보인 가운데, 인플레이션으로 인한 기업 이익 훼손에 대한 우려가 이어지면서 뉴욕 증시는 하락세로 마감"
25,21.10.13,Start with IBKS,"- KOSPI는 기관과 외국인의 동반 순매도에 하락함. 미 고용 쇼크와 에너지 가격 급등에따른 인플레이션 우려로 투자심리가 위축됨. 전기전자 업종을 중심으로 매도세가 확대되며 증시에 하방 압력으로 작용. 전 거래일 대비 1.35% 하락한 2,916.38P로 마감- KOSDAQ은 원자재 발 인플레이션 우려 확산으로 하락함. 인플레이션 우려 속 장 중 원/달러 환율이 1,200원을 돌파하며 2영업일 연속 기관과 외국인은 순매도함. 전 거래일 대비1.36% 하락한 940.15P로 마감"
26,21.10.12,"아시아 증시, 인플레이션 부담과 테이퍼링 임박 영향..","- 코스피, 코스닥 모두 -1%대 약세. 기관과 외국인이 순매도 확대하며 지수 하락 견인- 반도체 업황 부진 전망에 따라 외국인이 전기전자 업종을 집중 매도. 삼성전자 7만원선하회하며 코스피 지수 하락 주도. 국제 유가 급등에 따른 화학업종 상승. 정유주를 비롯한LG화학, SK이노베이션 등 전기차 배터리 관련주 상승 - 금일 금융통화위원회에서 글로벌경기 둔화 우려 반영해 기준금리 동결 발표. 다만, 최근 물가상승률이 가파르게 상승함에 따라 11월 기준금리 인상 예고 - 특히, 달러/원 환율 장중 1200원 돌파. 테이퍼링 임박과 인플레이션 압박 등으로 인한 안전자산 선호심리 확대 지속"
27,21.10.12,eBest Quant Daily,"<미국: 인플레이션 우려에 하락세>- 다우 : 34,496.06(-0.72%) / S&P500 : 4,361.19(-0.69%) / 나스닥 : 14,486.20(-0.64%)- 9월 컨퍼런스보드 고용추세지수(ETI)는 110.35를 기록하며 지난달(110.68) 대비하락- 세계은행은 올해 경제성장률을 5.7%, 내년은 4.4%로 전망하고, 선진국의 일인당국민소득은 5% 성장할 것으로 전망하지만 저소득 국가는 0.5%에 불과하다며 불평등이 심화되고 있다고 평가- 경기회복 및 겨울을 앞둔 수요 기대감이 이어진 가운데, 타이트한 공급우려 역시 이어지면서 WTI유가는 전일대비 2.3% 상승한 81.14$/bbl을 기록-콜럽부스 기념일로 미국 채권 시장이 휴장하고 한산한 거래를 보인 가운데 유가 상승으로 에너지와 소재 업종을 중심으로 상승세로 출발한 뉴욕 증시는, 이번 주 대형 은행주의 실적 발표를 앞둔 경계감과 인플레이션 우려가 더해지면서 오후들어 하락세로 전환"
